url,POSTING_CARD_GALLERY,price_value,price_type,expenses_value,expenses_type,location,POSTING_CARD_FEATURES,description,CARD_FAV,POSTING_CARD_PUBLISHER,CARD_VIEWPHONE,CARD_WHATSAPP,CARD_CONTACT_MODAL,address,square_meters_area,rooms,bathrooms,phone,bedrooms,parking
/propiedades/clasificado/alclapin-monoambiente-amplio-con-balcon-y-parrilla-propia-55323939.html,26,520000,$,143000,$,"Saavedra, Capital Federal",44 m² tot.1 amb.1 baño,"Monoambiente en alquiler en Saavedra. Moderno monoambiente muy luminoso! Con hermosa vista abierta al contrafrente. Cuenta con 45m2, balcón aterrazado con parrilla propia, living comedor con cocina semi-integrada, baño completo, numerosos amenities y cochera. Valor de expensas: $143. 000 aprox. - descripción - - Amplio living comedor con divisorio hecho a nuevo (que no se visualiza en las fotos), excelente ventilación y gran ventanal que accede al balcon aterrazado con parilla propia. - cocina semi integrada al living comedor, totalmente equipada conformada por: Alacenas, bajo mesada, mesada de granito, cuenta con gas natural, calefaccion por losa radiante y agua caliente por caldera individual. - Comodo y moderno vestidor. -amenities en el piso superior que cuentan con: Gran sum cubierto, cocina totalmente equipada y amplio balcon, ideal para reuniones. Ademas cuenta con hermosa terraza toda descubierta con enorme parrilla y gran vista abierta. El piso cuenta también con baños para ambos sexos y espacio para guardado de sillas, mesas y accesorios para los eventos en el sum. - El Barrio - Saavedra es un barrio residencial ubicado en el norte de la ciudad de Buenos Aires, limita con los barrios de Núñez al este, Coghlan y Villa Urquiza al sur, y con el partido de Vicente Lopez al norte. Se encuentra rodeado de espacios verdes ideal para andar en bicicleta o salir a caminar en familia, a 6 cuadras del parque Saavedra, a 2 de Plaza Balcarce, a 8 de plaza Benjamín Vicuña y Cercano a diversos locales comerciales, restaurantes y numerosos medios de transportes. - Ubicación geográfica: - ¡Excelentes accesos! Ubicado en barrio Saavedra sobre la calle Paroissien, entre Ciudad de La Paz y Amenábar, rodeado de importantes Avenidas, a 1 cuadra de Av. Cabildo, a 1 de Av. García del Rio, a 3 de Av. Cramer y de la Estación Nuñez del ferrocarril Mitre. - Transporte cercanos: - Colectivos: 59-60-Ver datos-151-29-Ver datos-184. Tren: ffcc Mitre (Núñez) - Contáctate con nosotros! - Coordina tu visita al: Ver datos / 5215. Whatsapp: 1Ver datos. Nos encontrás en las oficinas: Av. Mosconi 3467, Villa Devoto, caba. werba. com. ar. cucicba M. N 7317 - werba inmuebles. Se deja constancia que las medidas en m2 son aproximados y a solo efecto orientativo, al igual que las medidas parciales de los ambientes, y el valor consignado de las expensas mensuales esta sujeto a verificacion y/o ajustes. El precio del inmueble puede ser modificado sin previo aviso. Fotos de caracter no contractual. . - werba inmuebles. - Para los casos de alquiler de vivienda, el monto máximo de comisión que se le puede requerir a los propietarios será el equivalente al cuatro con quince centésimos por ciento (4, 15%) del valor total del respectivo contrato. Se encuentra prohibido cobrar a los inquilinos que sean personas físicas comisiones inmobiliarias y gastos de gestoría de informes. xintel(wer-wer-1604)",,,,WhatsApp,Contactar,PAROISSIEN 2500. Entre Amenabar y Ciudad de la paz,44,1,1,,,
/propiedades/clasificado/alclapin-alquier-saavedra-1-ambiente-estrenar-55570550.html,18,450000,$,50000,$,"Saavedra, Capital Federal",31 m² tot.1 amb.1 baño,"Departamento de 1 ambiente al frente con gran balcon estrenar Departamento de un ambiente al frente, con gran balcón aterrizado, vidriado, ambiente piso de porcelanato con losa radiante eléctrica, placard con interiores, anafe eléctrico, baño completo con mampara. Muy luminoso, ambiente 4 x 3, 65. Vista abierta. Bajas expensas. Terraza con pasto artificial. Requisitos: 1 mes adelanto, 1 mes de depósito, recibidos de sueldo, garantía propietaria o seguro de caución. *Todas las operaciones inmobiliarias son concluidas por los martilleros y corredores colegiados, cuyos datos se exhiben debajo del nombre de la Empresa. Corredores publicos Y martilleros responsables: mario lópez moyano cmcpsi 3869. Mariela lópez dulce cucicba 8109. *aviso legal: Las descripciones arquitectónicas y funcionales, valores de expensas, impuestos y servicios, fotos y medidas de este inmueble son aproximados. Los datos fueron proporcionados por el propietario y pueden no estar actualizados a la hora de la visualización de este aviso por lo cual pueden arrojar inexactitudes y discordancias con las que surgen de los las facturas, títulos y planos legales del inmueble. Los precios indicados podrán modificarse sin previo aviso. La fechas de inicio de obra o posesión son estimadas, podrán ser reprogramadas por la Dirección de obra y dependerán a su vez de un proceso de aprobaciones municipales u otros organismos intervinientes. El interesado deberá realizar las verificaciones respectivas previamente a la realización de cualquier operación, requiriendo por sí o sus profesionales las copias necesarias de la documentación que corresponda. Venta supeditada al cumplimiento por parte del propietario de los requisitos de la resolución general Nº 2371 de la afip (pedido de coti). La publicación de este inmueble es a título informativo, la venta de la propiedad está supeditada a que el propietario cumplimente el trámite ante la afip para la obtención del Número de coti correspondiente. Asimismo en cumplimiento con la Ley 10. 973 de la Prov. Bs. As. , Ley 22. 802 de Lealtad Comercial, Ley 24. 240 de Defensa al Consumidor, las normas del Código Civil y Comercial de la Nación y Constitucionales, los agentes y/o vendedores no ejercen el corretaje inmobiliario.",,,,WhatsApp,Contactar,Tamborini al 2900,31,1,1,,,
/propiedades/clasificado/alclapin-alquiler-coghlan-1-amb-cocina-separada-lava-55596835.html,13,400000,$,65000,$,"Coghlan, Capital Federal",26 m² tot.1 amb.1 baño,"Corredor Responsable: Luis María Varela csi 5527 / cpi 3872- Contacto: Paola Yervasi. Departamento en alquiler de un ambiente - Espectacular vista panorámica- muy luminoso- Excelente ubicación. bajas expensas: $65. 000. - con aysa incluido. Monoambiente. Pisos de parquet - Gran placard. Estufa de tiro balanceado. Cocina totalmente equipada y refaccionada. - Muebles bajo mesada - Alacena - cocina a gas - lugar para una heladera grande- baño. Lavadero independiente - lugar para el lavarropas, y espacio para colgar ropa. Termotanque eléctrico. A una cuadra de la estación de tren \""Coghlan\"" A pocas cuadras de uba - Drago - Centro Comercial. Hospital Pirovano a 700 mts. A una cuadra de Av. Congreso - líneas de colectivo. Requisitos: - Contrato por 2 años - actualización trimestral por ipc. - Garantía: Seguro de Caución Finaer. - Demostración de ingresos- - Depósito de 1 mes. Remax Argentina S. R. L. No ejerce el corretaje inmobiliario. El presente sitio web es una plataforma en donde cada oficina inmobiliaria independiente que contrata los servicios re/max puede publicar las propiedades a su cargo. Cada oficina es de propiedad y gestión independiente, por lo que Remax Argentina S. R. L no interviene en los datos de la publicación, en la operación inmobiliaria, ni en la confección y/o firma del boleto de compraventa y/o escritura y/o contrato de alquiler. En cumplimiento de las leyes vigentes que regulan el corretaje inmobiliario, Ley Nacional 25. 028, Ley 22. 802 de Lealtad Comercial, Ley 24. 240 de Defensa al Consumidor, las normas del Código Civil y Comercial de la Nación y Constitucionales, los agentes/gestores no ejercen el corretaje inmobiliario. Todas las operaciones inmobiliarias son objeto de intermediación y conclusión por parte del corredor público inmobiliario colegiado a cargo de la publicación, cuyos datos se exhiben en la presente. La presente publicación describe las características esenciales del inmueble, debiéndose consultar al corredor público inmobiliario responsable de la operación por la eventual actualización de las medidas, descripciones arquitectónicas y funcionales, valores de expensas, servicios, impuestos, precios y demás información, cuyos valores son aproximados. Para los casos de alquiler de vivienda, el monto máximo de comisión que se le puede requerir a los propietarios será el equivalente al cuatro con quince centésimos por ciento (4, 15%) del valor total del respectivo contrato. Se encuentra prohibido cobrar a los inquilinos que sean personas físicas comisiones inmobiliarias y gastos de gestoría de informes. El inmueble no es accesible para personas con discapacidades físicas.",,,,WhatsApp,Contactar,Manuel Ugarte 3800,26,1,1,,,
/propiedades/clasificado/alclapin-monoambiente-amoblado-en-alquiler-en-coghlan-55456588.html,9,450000,$,74000,$,"Coghlan, Capital Federal",32 m² tot.1 amb.1 baño,"Hermoso monoambiente amoblado en alquiler. No acepta mascotas! Excelente ubicación sobre Ricardo Balbín al 2500, entre Franklin D. Roosevelt y Av. Monroe. A 2 cuadras del Hospital Pirovano y a 6 de Cabildo. Este luminoso ambiente cuenta con: microondas, heladera, sillon, mesita, puff, cama con cajonera, aire acondicionado frio/calor, tele, mesa con dos sillas, mueble de guardado. Monoambiente ubicado en el 10º al contrafrente. Super luminoso! Con orientación Oeste. Calefacción por losa radiante individual y aire acondicionado F/C. Cocina integrada con muebles altos y bajo mesada, anafe y horno electrico, monocomando y spar. Balcon con vista abierta, conexión para lavarropasBaño completo. Edificio con amenities en ultimo piso (Pileta, sum y parrilla) 13º // 3 departamentos en la planta tipo. sin encargado. Agua caliente central. Apto profesional. Requisitos: Demostración de Ingresos en blanco que tripliquen el valor del alquiler. En caso de presentar monotributo, debe constar la categoría y facturación correspondiente. / Garantía propietaria en caba de familiar directo o Seguro de caución / Antigüedad laboral a partir de un año / Contrato 24 meses / Depósito en dólares / Pedido de informes Dominio, Inhibición, Frecuencia. / Gasto de certificación de firmas. Aumento trimestral por ipc. apto para personas con movilidad reducida. C. U. C. I. C. B. A. - Matricula Nº 597 - Nota importante: Toda la información y medidas provistas son aproximadas, deberán ratificarse con la documentación pertinente y no compromete contractualmente a nuestra empresa. Los gastos (expensas, abl) expresados refieren a la última información recabada y deberán confirmarse. Fotografías no vinculantes ni contractuales. - C. U. C. I. C. B. A. - Matricula Nº 597 -Nota importante: Toda la información y medidas provistas son aproximadas, deberán ratificarse con la documentación pertinente y no compromete contractualmente a nuestra empresa. Los gastos (expensas, abl) expresados refieren a la última información recabada y deberán confirmarse. Fotografías no vinculantes ni contractuales.",,,,WhatsApp,Contactar,Ricardo Balbin 2500,32,1,1,,,
/propiedades/clasificado/alclapin-ambiente-en-urquiza-con-amenities-seguridad-24hs-55438733.html,9,450000,$,175000,$,"Coghlan, Capital Federal",31 m² tot.1 amb.1 baño,"** hermoso ambiente con balcón en inmejorable ubicación de villa urquiza / villa ortuzar ** apto profesional **donado Y roseti, A una cuadra de triunvirato y A tres cuadras de av de los incas. (A solo tres cuadras delsubte &quot;B&quot;) -A solo 3 cuadras del subte &quot;B&quot;. Estacion av de los incasedificio con piscina, seguridad 24hs, sum, sector parrillas, laundry. Baño completo, cocina integrada con bajo mesada, amplio ambiente aire acondicionado frio calor. Contrato a dos años con ajuste trimestral x icl. disponible!",,,,WhatsApp,Contactar,Roseti 2052,31,1,1,,,
/propiedades/clasificado/alclapin-monoambiente-en-alquiler-coghlan-belgrano-55514946.html,31,450000,$,156000,$,"Coghlan, Capital Federal",42 m² tot.1 amb.1 baño,"Corredor Responsable: Raul Hector Merlo cucicba 2407 / cmcpsi 5438- Contacto: Claudia Szakiel. Alquiler Monoambiente en Coghlan al límite con Belgrano. Se ofrece en alquiler un monoambiente luminoso, ubicado en el 2° piso al frente, en el barrio de Coghlan. La unidad cuenta con las siguientes características: Cocina integrada con desayunador, artefactos eléctricos y bajo mesada a medida, brindando comodidad y funcionalidad. Baño completo con bañera. Ambiente principal 37, 50m con salida al balcón de 4, 00m, perfecto para disfrutar del aire libre y la luz natural. El edificio ofrece servicios adicionales como losa radiante, aire acondicionado, agua por caldera, laundry, y cámaras de seguridad. Alquiler: $450. 000 + expensas + servicios. Expensas: $156. 000 incluye Aysa. Condiciones de Ingreso: Seguro de caución y demostración de ingresos. Mes de depósito $450. 000 y el mes de alquiler por adelantado. Duración del contrato: 24 meses, con ajustes trimestrales basados en el índice ipc (Indice de Precios al Consumidor). Ubicación: Situado sobre calle Roosevelt entre Conde y Freire, a solo 1 cuadra de Av. Monroe, Av. Ricardo Balbín y Dr. Pedro Rivera. A 3 cuadras de Av. Cramer y a 8 cuadras de Av. Cabildo, con cercanía a las estaciones del subte D: Congreso de Tucumán y Juramento, lo que proporciona una excelente conectividad al resto de la Ciudad. Remax Argentina S. R. L. No ejerce el corretaje inmobiliario. El presente sitio web es una plataforma en donde cada oficina inmobiliaria independiente que contrata los servicios re/max puede publicar las propiedades a su cargo. Cada oficina es de propiedad y gestión independiente, por lo que Remax Argentina S. R. L no interviene en los datos de la publicación, en la operación inmobiliaria, ni en la confección y/o firma del boleto de compraventa y/o escritura y/o contrato de alquiler. En cumplimiento de las leyes vigentes que regulan el corretaje inmobiliario, Ley Nacional 25. 028, Ley 22. 802 de Lealtad Comercial, Ley 24. 240 de Defensa al Consumidor, las normas del Código Civil y Comercial de la Nación y Constitucionales, los agentes/gestores no ejercen el corretaje inmobiliario. Todas las operaciones inmobiliarias son objeto de intermediación y conclusión por parte del corredor público inmobiliario colegiado a cargo de la publicación, cuyos datos se exhiben en la presente. La presente publicación describe las características esenciales del inmueble, debiéndose consultar al corredor público inmobiliario responsable de la operación por la eventual actualización de las medidas, descripciones arquitectónicas y funcionales, valores de expensas, servicios, impuestos, precios y demás información, cuyos valores son aproximados. Para los casos de alquiler de vivienda, el monto máximo de comisión que se le puede requerir a los propietarios será el equivalente al cuatro con quince centésimos por ciento (4, 15%) del valor total del respectivo contrato. Se encuentra prohibido cobrar a los inquilinos que sean personas físicas comisiones inmobiliarias y gastos de gestoría de informes. El inmueble no es accesible para personas con discapacidades físicas.",,,,WhatsApp,Contactar,Franklin D. Roosevelt 3200,42,1,1,,,
/propiedades/clasificado/alclapin-monoambiente-amoblado.-frente.-balcon.-coghlan-55553469.html,20,500000,$,50000,$,"Coghlan, Capital Federal",39 m² tot.1 amb.1 baño,"En Zapiola y Tamborini a pasos de Cramer, te traemos este hermoso monoambiente amoblado, listo para que lo ocupes. Diseño minimalista. Moderno. El edificio cuenta con amplios espacios comunes. Es al frente con un balcón aterrazado de grandes dimenciones El departamento está en el 2 ° piso. Tiene baño completo La cocina integrada está muy bien equipada. Split A/A y calefacción por losa radiante que controlás desde la misma unidad. Lo ofrecemos amoblado. También tenes la opción de alquilarlo sin los muebles, consultanos. Condiciones de contratación Contrato por 24 meses Ajuste cuatrimestral por icl Garantía Propietaria en caba o seguro de caución, Finaer, Afianzar, Respaldar o Premium Depósito 2 meses o su equivalente en U$S Se requieren ingresos comprobables, el monto del alquiler no debe superar el 30 % de los ingresos. Para máximo 2 personas. No se aceptan mascotas. Gastos a cargo del locador: expensas comunes, abl ( tasa Alumbrado Barrido y limpieza) y Aysa y servicio. Gastos por informes comerciales y de garantía. Certificación de firmas en escribanía. Se solicitará al locatario seguro de incendio. Matrícula Nº 5982 cucicba. Para los casos de alquiler de vivienda, el monto máximo de comisión que se le puede requerir a los propietarios será el equivalente al cuatro con quince centésimos por ciento (4, 15%) del valor total del respectivo contrato. Se encuentra prohibido cobrar a los inquilinos que sean personas físicas comisiones inmobiliarias y gastos de gestoría de informes. - Se deja constancia que las medidas, superficies, m² y proporciones consignadas son aproximados, al igual que las medidas parciales y/o de los ambientes están sujetas a verificación y/o ajuste. Las reales surgirán de los respectivos planos y/o escritura. El valor indicado de expensas está sujeto a variación. El precio del inmueble puede ser modificado sin previo aviso. Fotos de carácter no contractual.",,,,WhatsApp,Contactar,Zapiola 3216,39,1,1,,,
/propiedades/clasificado/alclapin-departamento-de-1-ambiente-55437095.html,6,350000,$,80000,$,"Saavedra, Capital Federal",30 m² tot.1 amb.1 baño,"Departamento de 1 ambiente al contrafrente con balcón, cocina separada y baño completo. Separador de ambiente. Luminoso",,,,WhatsApp,Contactar,Superi  3500 2°,30,1,1,,,
/propiedades/clasificado/alclapin-alquiler-monoambiente-a-prof.-balcon.-holmberg-4100-55497637.html,7,370000,$,115000,$,"Saavedra, Capital Federal",31 m² tot.1 amb.1 baño,"Impecable monoambiente. Apto profesional. Orientado al frente. Balcon aterrazado. Living comedor. Cocina integrada con anafe electrico. Baño completo. Lavadero incorporado. Pisos de porcelanato. Servicios Centrales. Aysa incluida en expensas. Ubicación: Entre Vilela y Besares. A metros de Estación Saavedra ffcc Mitre y Corredor Aeróbico de Donado, a una cuadra de Av. Balbín, 1/2 cuadra del Hipermercado coto, y a 6 cuadras equidistantes del Parque Sarmiento y Parque Saavedra. Condiciones basicas de alquiler de caba: depósito, mes adelantado, Garantía (preferentemente garantía propietaria de caba o gba Zona Norte o Garantía de fianza), Justificación de ingresos, gastos de certificación de firmas y averiguación de garantía. De lisio consultores inmobiliarios. C. U. C. I. C. B. A 4553. Para los casos de alquiler de vivienda, el monto máximo de comisión que se le puede requerir a los propietarios será el equivalente al cuatro con quince centésimos por ciento (4. 15%) del valor total del respectivo contrato. Se encuentra prohibido cobrar comisiones inmobiliarias y gastos de gestoría de informes a los inquilinos, en el caso de ser personas físicas. Se deja constancia que los m2 indicados son aproximados, al igual que las medidas parciales de los ambientes, y el valor consignado de expensas mensuales está sujeto a verificación y/o ajustes. El precio del inmueble puede ser modificado sin previo aviso. Fotos y funcionamiento de artefactos de carácter no contractual. Medidas aproximadas. balcon aterrazado. 4, 8 x 1, 4. living comedor. 5, 7 x 3. cocina integrada con anafe electrico. 2, 9 x 1, 5. baño completo. 1, 5 x 2, 3",,,,WhatsApp,Contactar,Holmberg 4100,31,1,1,,,
/propiedades/clasificado/alclapin-departamento-saavedra-55553110.html,14,350000,$,140000,$,"Saavedra, Capital Federal",28 m² tot.1 amb.1 baño,Departamento Monoambiente al frente con balcón! Son 28 m2 cubiertos + 3 m2 de balcón. Contrato A 2 años actualizado trimestralmente por ipc,,,,,Contactar,Quintana al 4700,28,1,1,,,
/propiedades/clasificado/alclapin-alquiler-saavedra-1-amb-departamento-monoambiente-55446185.html,16,530000,$,99812,$,"Saavedra, Capital Federal",41 m² tot.1 amb.1 baño,"Increíble monoambiente con vestidor, suite y toilette. Conexión lavarropa, barra desayunadora y balcón francés. ¿Listo para conocer tu nuevo hogar? Sumergite en una experiencia única: ¡Descubrí nuestro Open house 24x7! Explora virtualmente el departamento con nuestro tour 360º y disfruta de videos detallados. ¡No te lo pierdas! Excelente zona, próximo a Av. Balbín y Crisologo Larralde, con múltiples comercios, supermercados, bancos, etc. Transporte cercano: Colectivos: 29, 67, 71, 76, 130. Trenes: Est. Luis María Saavedra (fc mitre - Retiro) Monoambiente con balcón francés, vestidor y toilette (2 baños). Cocina con barra desayunadora. Destacados: - Monoambiente al contrafrente. - Cocina super equipada con alacenas, bajo mesada y barra desayunadora. - Vestidor con colgar corto y largo. - Aire acondicionado primera marca. - Pisos de porcelanato/flotante. - Agua caliente central. - Baño completo con accesorios, espejo y bañera. - Balcón francés. - Conexión para lavarropa. - Toilette. Importante: - El departamento se entrega recién pintado, deberá devolverse en idénticas condiciones. - Locatario debe justificar ingresos comprobables (jubilaciones y pensiones no, ya que son inembargables) acorde al monto del alquiler y expensas. - Contrato por dos años. - Ajuste trimestral icl. - 1 mes de deposito. - Abl/inmobiliario y seguro integral a cargo del locatario. - Propietario no acepta mascotas. - Se requiere garantía Finaer. Apto sistemas de garantías de alquiler Finaer. Visitas solo acompañado con personal de la firma.",,,,WhatsApp,Contactar,NAON 3600,41,1,1,,,
/propiedades/clasificado/alclapin-departamento-en-alquiler-en-saavedra-capital-federal-55576382.html,14,550000,$,100000,$,"Saavedra, Capital Federal",36 m² tot.1 amb.,"Monoambiente Al Frente con Amenities - Saavedra. monoambiente al frente con amenities - saavedra. Departamento de 36, 00 m² - living comedor: 4. 50 x 3. 60. - cocina integrada: 1. 90 x 0. 85. - dormitorio: 2. 90 2. 85. - 1 baño. - balcon: 5. 50 x 1. 50. requisitos de alquiler para viviendas: *seguro de caución finaer excluyente. *recibo de sueldo, comprobantes de ingresos justificados. * gastos de -luz – gas- – aysa- abl A cargo del locatario. *vigencia del contrato: 24 meses. *máximo de ocupantes: 2. *mascotas: no. *incrementos cuatrimestral indice ipc. *A tener en cuenta: todos los contratos detallan que el locatario deberá gestionar un seguro contra incendio, resp. Civil Y linderos A favor del locador. *el valor de expensas en el caso de poseer, es A modo orientativo, los valores exactos serán A verificar de acuerdo A la última liquidación. Se encuentra prohibido cobrar comisiones inmobiliarias Y gastos de gestoría de informes A los inquilinos que sean personas físicas. Para los casos de alquiler de vivienda, el monto máximo de comisión que se le puede requerir A los propietarios será el equivalente al cuatro con quince centésimos por ciento (4, 15%) del valor total del respectivo contrato (conf. El art. 4 de la ley 5. 859 de C. A. B. A) aviso legal: las descripciones arquitectónicas Y funcionales, valores de expensas, impuestos Y servicios, fotos Y medidas de este inmueble son aproximados. Los datos fueron proporcionados por el propietario Y pueden no estar actualizados A la hora de la visualización de este aviso por lo cual pueden arrojar inexactitudes Y discordancias con las que surgen de los las facturas, títulos Y planos legales del inmueble. El interesado deberá realizar las verificaciones respectivas previamente A la realización de cualquier operación, requiriendo por sí O sus profesionales las copias necesarias de la documentación que corresponda. Matricula C. U. C. I. C. ba N° 6651 Y matricula C. M. C. P. S. I N° 6192. matias marcolini propiedades. Ver datos. www. marcoliniprop. com. ar. tel. Ver datos. Edificio de 4 años de antigüedad. - cuenta con solarium, pileta, parrilla, sum, gym Y laundry. Agua caliente central Y calefaccion por loza radiante, piso de porcelanato en el living, piso flotante en el dormitorio Y placares espejados con interiores completos.",,,,WhatsApp,Contactar,Av Ricardo Balbín 4300,36,1,,,,
