url,POSTING_CARD_GALLERY,price_value,price_type,expenses_value,expenses_type,location,POSTING_CARD_FEATURES,description,CARD_FAV,POSTING_CARD_PUBLISHER,CARD_VIEWPHONE,CARD_WHATSAPP,CARD_CONTACT_MODAL,address,square_meters_area,rooms,bathrooms,phone,bedrooms,parking
/propiedades/clasificado/alclapin-departamento-en-alquiler-en-saavedra-capital-federal-55576382.html,14,550000,$,100000,$,"Saavedra, Capital Federal",36 m² tot.1 amb.,"Monoambiente Al Frente con Amenities - Saavedra. monoambiente al frente con amenities - saavedra. Departamento de 36, 00 m² - living comedor: 4. 50 x 3. 60. - cocina integrada: 1. 90 x 0. 85. - dormitorio: 2. 90 2. 85. - 1 baño. - balcon: 5. 50 x 1. 50. requisitos de alquiler para viviendas: *seguro de caución finaer excluyente. *recibo de sueldo, comprobantes de ingresos justificados. * gastos de -luz – gas- – aysa- abl A cargo del locatario. *vigencia del contrato: 24 meses. *máximo de ocupantes: 2. *mascotas: no. *incrementos cuatrimestral indice ipc. *A tener en cuenta: todos los contratos detallan que el locatario deberá gestionar un seguro contra incendio, resp. Civil Y linderos A favor del locador. *el valor de expensas en el caso de poseer, es A modo orientativo, los valores exactos serán A verificar de acuerdo A la última liquidación. Se encuentra prohibido cobrar comisiones inmobiliarias Y gastos de gestoría de informes A los inquilinos que sean personas físicas. Para los casos de alquiler de vivienda, el monto máximo de comisión que se le puede requerir A los propietarios será el equivalente al cuatro con quince centésimos por ciento (4, 15%) del valor total del respectivo contrato (conf. El art. 4 de la ley 5. 859 de C. A. B. A) aviso legal: las descripciones arquitectónicas Y funcionales, valores de expensas, impuestos Y servicios, fotos Y medidas de este inmueble son aproximados. Los datos fueron proporcionados por el propietario Y pueden no estar actualizados A la hora de la visualización de este aviso por lo cual pueden arrojar inexactitudes Y discordancias con las que surgen de los las facturas, títulos Y planos legales del inmueble. El interesado deberá realizar las verificaciones respectivas previamente A la realización de cualquier operación, requiriendo por sí O sus profesionales las copias necesarias de la documentación que corresponda. Matricula C. U. C. I. C. ba N° 6651 Y matricula C. M. C. P. S. I N° 6192. matias marcolini propiedades. Ver datos. www. marcoliniprop. com. ar. tel. Ver datos. Edificio de 4 años de antigüedad. - cuenta con solarium, pileta, parrilla, sum, gym Y laundry. Agua caliente central Y calefaccion por loza radiante, piso de porcelanato en el living, piso flotante en el dormitorio Y placares espejados con interiores completos.",,,,WhatsApp,Contactar,Av Ricardo Balbín 4300,36,1,,,,
/propiedades/clasificado/alclapin-alquiler-1-ambiente-55602386.html,14,400000,$,100000,$,"Saavedra, Capital Federal",41 m² tot.1 amb.1 baño,"Alquiler 1 Ambiente. Sobre García del Río al 4000 entre Tronador y Estomba, barrio de Saavedra. Excelente departamento de 1 Ambiente, orientación Este. Totalmente Luminoso (Ver fotos). Excelente Ubicación: A tan solo 200 metros de la estación Saavedra - Ferrocarril Mitre - hacia y desde Retiro. A tan solo 100 metros de Av. Ricardo Balbín. A tan solo 400 metros del Parque Saavedra. Configuración de la unidad: Balcón Corrido al Frente. Anafe eléctrico. Muebles de cocina altos y bajos. Agua caliente central. Barra desayunadora. Equipo de aire acondicionado frío / calor. Ventilador de Techo. Cortinas / Blackout. Apliques de luces. Placard completo. Baño Completo. Amenities: Laundry. Requerimientos: no Apto Mascotas. No Apto Profesional. Mes de adelanto. Mes en depósito U$D 450. Seguro de Caución: finaer - garantia ya. Seguro de Responsabilidad Civil / Incendio. Ajustes Cuatrimestrales - ipc / Indec. Expensas Ordinarias. Abl / Impuesto Inmboliario. Para mayor grado de información, esperamos tú comunicación Vía WhatsApp. - Cumple Acceso para personas con movilidad reducida. Honorarios inmobiliarios a cargo del Locador. - cucicba 6820",,,,WhatsApp,Contactar,García del Río 4000,41,1,1,,,
/propiedades/clasificado/alclapin-departamento-de-1-ambiente-55437095.html,6,350000,$,80000,$,"Saavedra, Capital Federal",30 m² tot.1 amb.1 baño,"Departamento de 1 ambiente al contrafrente con balcón, cocina separada y baño completo. Separador de ambiente. Luminoso",,,,WhatsApp,Contactar,Superi  3500 2°,30,1,1,,,
/propiedades/clasificado/alclapin-alquiler-departamento-mono-ambiente-a-estrenar-en-55535614.html,16,430000,$,100000,$,"Saavedra, Capital Federal",30 m² tot.1 amb.1 dorm.1 baño,"Alquiler de Departamento en Saavedra mono ambiente bio estudios te ofrece la oportunidad de vivir en un espacio moderno a estrenar y con todas las comodidades que necesitas. Beneficios para tu día a día: - Espacios luminosos y bien distribuidos: Este departamento tipo mono ambientes tiene un diseño inteligente para aprovechar al máximo cada rincón. - Cocina completa: Con Anafe a gas y horno eléctrico, espacio para lavarropa o lavavajilla, alacenas. Equipada con todo lo necesario para preparar tus comidas favoritas. - Airea acondicionado frio calor incluido. Carpinterías de aluminio con dvh. - Amenities pensadas para vos: sum/espacio Co-Work en planta baja, y parrilla en la terraza verde con piscina, También laundry y bicicletero. - Camaras de seguridad en en todos los pisos. - Ubicación estratégica: En Saavedra, con excelente conectividad y acceso a transporte público, comercios y servicios. - Condiciones: Contrato puede ser a dos años o un año, con ajuste trimestral por icl Es requisito excluyente para la garantía contratar seguro de garantía, fianza o caución. ¡Viví como siempre quisiste! Corredor Aníbal HernandoMatriculas: 8595 cucicba / 283 cmcpdjmgr",,,,WhatsApp,Contactar,Machain 4912 Uf11,30,1,1,,1,
/propiedades/clasificado/alclappa-excelente-departamento-con-balcon-t-parrilla-55402582.html,10,340000,$,120000,$,"Coghlan, Capital Federal",30 m² tot.1 amb.1 dorm.1 baño,"Departamento luminoso, con sol. Posee balcón a la calle y parrilla. Bano completo, agua caliente central. Pedimos garantia por seguros de caución o garantia propietaria. Contactarse por whatApp Ver datos. Eduardo Whatsapp Ver datos",,,,WhatsApp,Contactar,Manuela Pedraza 3787,30,1,1,,1,
/propiedades/clasificado/alclappa-dueno-directo-monoambiente-en-saavedra-52399216.html,10,450000,$,55000,$,"Saavedra, Capital Federal",38 m² tot.1 amb.,Excelente monoambiente. Edificio con amenities. Sum. Parrilla. Jacuzzi. Ubicado a cuadras del Parque Saavedra. Expensas de Enero $ 55. 000 (incluyen agua y gas) Aparte se paga la luz y el abl. Dueño directo. Para saber condiciones contactarse por Whatsapp,,,,WhatsApp,Contactar,Holmberg,38,1,,,,
