url,POSTING_CARD_GALLERY,price_value,price_type,expenses_value,expenses_type,location,POSTING_CARD_FEATURES,description,CARD_FAV,POSTING_CARD_PUBLISHER,CARD_VIEWPHONE,CARD_WHATSAPP,CARD_CONTACT_MODAL,address,square_meters_area,rooms,bathrooms,phone,parking,bedrooms
/propiedades/clasificado/veclapin-departamento-42-m-sup2--totales-balcon-corrido-52823816.html,18,115000,USD,60000,$,"Saavedra, Capital Federal",42 m² tot.1 amb.1 baño,"Monoambiente divisible. balcon corrido. calidad constructiva. Superficie Cubierta: 35, 1 m2. Superficie Total: 42, 5 m2. Excelente departamento monoambiente en Saavedra en edificio apto profesional a estrenar con detalles de categoría. Cómodamente divisible por su metraje y por la disposición de sus ventanas, permitiendo que se generen dos ambientes bien distribuidos sin forzar la calidad espacial. Repleto de luz natural y vistas largas a un entorno arbolado y barrial, con acceso a un balcón corrido de 7, 40 m2, que se lleva todos los aplausos. A un paso de accesos rápidos a cualquier parte de caba y provincia de Bs. As. Cocina con mobiliario completo y conexión para lavarropas. Mesada de Silestone y extractor. Área de comedor y living. Sector del dormitorio con placar. Baño completo. Gas natural y calefacción por calefactores tiro balanceado. Pre instalación para equipos de aire acondicionado tipo Split tanto en el living como en el dormitorio. Agua caliente central. Portero visor. Espacio para bicicletas en el sótano. Ascensor de grandes dimensiones. Venta con renta. *Las medidas son aproximadas, las reales surgen del título o plano de mensura. *Ley 5115: excepto que en la descripción de la propiedad se indique lo contrario, el edificio puede no contar con rampa para personas con movilidad reducida, y no ser accesible para personas con discapacidades físicas. *coti en trámite. Cucicba 7508 - cmcpsi 6968. javurek propiedades",,,,WhatsApp,Contactar,"Lugones 4935, SAAVEDRA",42,1,1,,,
/propiedades/clasificado/veclapin-saavedra-departamento-venta-usd-84.900-53640683.html,11,84900,USD,,,"Saavedra, Capital Federal",38 m² tot.1 amb.1 dorm.1 baño,"Apto credito Lindísimo ambiente, segundo piso al frente a dos cuadras Parque Saavedra. Living Comedor de 3, 30 x 9, 40 más baño completo y balcón. Pisos plastificados en el living. Orientación este, sol de mañana. Aire frío calor, cocina a gas, agua caliente central. Cocina abierta con barra, muy agradable. Laundry en terraza. Balcón al este vista calle y ártboles de 1, 30 por 3, 30. Encargado medio día de lunes a sábado hasta las doce. Guanziroli Propiedades. Mónica Guanziroli. csi 3653 / cucicba 5348. [Provista por]",,,,WhatsApp,Contactar,MELIAN al 3500,38,1,1,,,1
/propiedades/clasificado/veclapin-departamento-en-saavedra-mono-ambiente-moderno-opcion-54937475.html,13,95000,USD,104000,$,"Saavedra, Capital Federal",37 m² tot.1 amb.1 baño1 coch.,"Excelente Monoambiente en Saavedra Moderno edificio en excelente ubicacion. Cercano a Av. Cabildo, Av Gral. Paz, Shopping dot. Gran cocina con mesadas de granito. Espacio para amplia heladera y lugar para lavarropas con conexion, Baño completo. Balcon. Zona muy tranquila y segura dentro de caba. opcion cochera fija cubierta uSs 110. 000",,,,WhatsApp,Contactar,Quintana al 4600,37,1,1,,1,
/propiedades/clasificado/veclapin-departamento-monoambiente-en-venta-en-saavedra-55499732.html,15,95000,USD,,,"Saavedra, Capital Federal",40 m² tot.1 amb.1 baño,". contactar por whatsapp Ver datos. . Excelente departamento monoambiente en excelente ubicacion a cuatro cuadras de Cabildo y muy proximo a General paz. . Muy luminoso con ventanal de piso a techo. . Cocina integrada, anafe, lugar para heladera y lavarropas. . Baño completo, balcon. . Aire acondicionado colocado. . El edificio cuenta con terraza y parrilla en el ultimo piso",,,,,Contactar,QUINTANA 4600,40,1,1,,,
/propiedades/clasificado/veclapin-ideal-inversor-monoambiente-en-alquiler-53516466.html,10,70000,USD,2900,$,"Saavedra, Capital Federal",28 m² tot.1 amb.1 baño,"Excelente monoambiente con balcón al contrafrente, orientación norte!! Vista abierta a corredor Donado!! Cocina integrada, conexión para lavarropas, baño completo y balcón!! Muy Luminoso, bajas expensas!! Excelente ubicación a dos cuadras de Av. Balbín y estación de tren Saavedra línea Mitre!! Equipo de aire acondicionado frio/calor!! Con contrato vigente hasta 1 de Junio de 2026!! Alquiler actual $ 317. 000!! corredora responsable susana de cristofaro matricula n° 2099 cucicba Se deja constancia que las características, medidas y superficies consignadas son aproximadas, sujetas a verificación y/o ajuste.",,,,WhatsApp,Contactar,Holmberg al 3700,28,1,1,,,
/propiedades/clasificado/veclapin-lindisimo-monoambiente-a-contrafrente-abierto!-53183772.html,11,105000,USD,112000,$,"Saavedra, Capital Federal",35 m² tot.1 amb.1 baño,"Lleno de luz y sol! En pleno Saavedra, próximo al dot y en corredor en pleno crecimiento. Monoambiente con simpático balcón y vista abierta a pulmón de manzana. En edificio de 4 años de antigüedad, amplio y cómodo monoambiente. Cocina integrada con barra alta. Baño completo. Muy bien puesto!!",,,,WhatsApp,Contactar,Arias 3040,35,1,1,,,
/propiedades/clasificado/veclapin-monoambiente-a-estrenar-en-saavedra-53103028.html,6,80489,USD,23336,$,"Saavedra, Capital Federal",39 m² tot.1 amb.1 baño,"Monoambiente a estrenarAmplio balcon al contrafrenteMuy luminosoAmplio para sectorizar y dividir la zona del dormitorio para tener mas privacidadMiller 4131: Todo enmarcado por una zona de “cielo abierto” que es un verdadero pulmón arbolado en la Ciudad. Inmejorables amenities: Solarium, sum, Parrilla y espacios comunes de muchísima utilidad, para completar el entorno ideal de un lugar único. Algunos detalles a destacar del edificio en general son: - Pisos en porcelanato de primera calidad símil madera. - Termotanques eléctricos para distribución de agua caliente. - Vanitorys, accesorios y griferías de primeras marcas. - Departamentos al frente con parrillas en todas las unidades. - Cocinas eléctricas. - Purificadores de aire. - Mesadas de granito negro boreal con pileta doble de acero inoxidable. cocheras disponibles! nota: Se deja constancia que los metros parciales, así como el monto de las expensas e impuestos son aproximados a título orientativo sujetos a verificación y/o ajustes. cucicba Nº 2996",,,,WhatsApp,Contactar,Miller 4131,39,1,1,,,
/propiedades/clasificado/veclapin-departamento-monambiente-divisible-a-estrenar!-52499313.html,21,115000,USD,48000,$,"Saavedra, Capital Federal",42 m² tot.1 amb.1 baño,"venta con renta hasta el 2026! Excelente oportunidad de inversión! Ubicado en el Barrio de Saavedra, próximo a Av. Gral Paz y acceso Zona Norte. Hermoso monoambiente divisible ubicado en el tercer al frente, con orientación oeste. Muy luminoso! Generoso Ambiente con pisos porcelanato símil madera, cuenta con tiro balanceado e instalación para aire acondicionado. Salida a balcón. Portero visor. Placard con interiores. Cocina integrada con muebles altos y bajos de primera línea, artefacto de cocina a gas de primer marca, y purificador. Monocomando y bacha de acero. Lavadero incorporado. Agua caliente central. Baño completo con accesorios y luz natural. Edificio moderno de 4 pisos con ascensor y espacio bicicletero en el sótano. Apto Profesional! Expensas $ 48. 000 aprox. Superficie cubierta 35. 10 m2 / Superficie descubierta: 7. 40 m2 / Superficie total de 42. 50apto para personas con movilidad reducida - C. U. C. I. C. B. A. - Matricula Nº 597 - Nota importante: Toda la información y medidas provistas son aproximadas, deberán ratificarse con la documentación pertinente y no compromete contractualmente a nuestra empresa. Los gastos (expensas, abl) expresados refieren a la última información recabada y deberán confirmarse. Fotografías no vinculantes ni contractuales. - C. U. C. I. C. B. A. - Matricula Nº 597 -Nota importante: Toda la información y medidas provistas son aproximadas, deberán ratificarse con la documentación pertinente y no compromete contractualmente a nuestra empresa. Los gastos (expensas, abl) expresados refieren a la última información recabada y deberán confirmarse. Fotografías no vinculantes ni contractuales.",,,,WhatsApp,Contactar,Lugones 4900,42,1,1,,,
/propiedades/clasificado/veclapin-departamento-en-venta-en-saavedra-capital-federal-55098788.html,12,82000,USD,37000,$,"Saavedra, Capital Federal",41 m² tot.1 amb.1 baño,"Hermoso monoambiente con balcón en un piso 8 (no último) en el barrio de Saavedra. Super luminoso y vista abierta. El inmueble se encuentra en perfectas condiciones. Actualmente lo habita un inquilino que se está retirando próximamente. Cuenta con un amplio placard, cocina integrada y un cómodo baño completo. / nota: Se deja constancia que las medidas, superficies, m2 y proporciones consignadas son aproximadas y pueden variar respecto del titulo de propiedad respectivo, al igual que las medidas parciales y/o de los ambientes están sujetas a verificación y/o ajuste sin comprometer a nuestra empresa. El valor indicado de expensas, si las hubiere, esta sujeto a variación. El precio del inmueble puede ser modificado sin previo aviso. Fotos de carácter no contractual. Todas las operaciones están a cargo de: Martillera Público Nancy Edith Moscovich. Matricula cmcpsi Nro. 1083. Martillera Melisa Yanet Buscaglia. Matricula cucicba Nro. 8702",,,,WhatsApp,Contactar,Avenida Doctor Ricardo Balbin 3600,41,1,1,,,
/propiedades/clasificado/veclapin-a-estrenar-en-saavedra-53102992.html,6,95640,USD,23336,$,"Saavedra, Capital Federal",39 m² tot.1 amb.1 baño,"Amplio Monoambiente a estrenar! Divisible para sectorizar la zona del dormitorio para dar privacidadBalcon Miller 4131: Todo enmarcado por una zona de “cielo abierto” que es un verdadero pulmón arbolado en la Ciudad. Inmejorables amenities: Solarium, sum, Parrilla y espacios comunes de muchísima utilidad, para completar el entorno ideal de un lugar único. Algunos detalles a destacar del edificio en general son: - Pisos en porcelanato de primera calidad símil madera. - Termotanques eléctricos para distribución de agua caliente. - Vanitorys, accesorios y griferías de primeras marcas. - Departamentos al frente con parrillas en todas las unidades. - Cocinas eléctricas. - Purificadores de aire. - Mesadas de granito negro boreal con pileta doble de acero inoxidable. cocheras disponibles! nota: Se deja constancia que los metros parciales, así como el monto de las expensas e impuestos son aproximados a título orientativo sujetos a verificación y/o ajustes. cucicba Nº 2996",,,,WhatsApp,Contactar,Miller 4131,39,1,1,,,
/propiedades/clasificado/veclapin-departamento-venta-monoambiente-coghlan-53951186.html,17,119000,USD,28000,$,"Coghlan, Capital Federal",43 m² tot.1 amb.1 dorm.1 baño,"Venta departamento 1 ambiente en Roosevelt al 3000, entre Conde y Superi, CoghlanExpensas $28. 000. - (Agosto 2023) Excelente 1 ambiente divisible en edificio con amenities. Departamento: Piso 4 a Pulmón de manzana. 440m2 totales. Ambiente principal de 9. 00x3. 00 + Cocina semi integrada con barra desayunador de madera, anafe y horno eléctrico. Buen balcón corrido con deck de madera 2. 90x1. 15Calefacción por piso radiante eléctrico regulable con termostato. Baño completo con bañera y grifería fv. Agua caliente central. sum con Parrilla y Pileta Comunitaria en terraza. Unidad con Contrato de Alquiler vigente hasta feb 2024, tiene Escritura. La información y medidas provistas son aproximadas y deberán ratificarse con la documentación pertinente y no compromete contractualmente a nuestra Empresa. Los Gastos expresados (expensas, abll, etc. ) se refieren a la última información recabada y deberán confirmarse. Las fotografías no vinculantes ni contractuales. .",,,,WhatsApp,Contactar,Roosevelt al 3300,43,1,1,,,1
/propiedades/clasificado/veclapin-departamento-en-venta-ubicado-en-saavedra.-54028804.html,30,115000,USD,12000,$,"Saavedra, Capital Federal",62 m² tot.1 amb.1 baño,"Lindísimo departamento en un tradicional barrio porteño. A dos cuadras del Parque Saavedra. Con imponente vista panorámica de todo el barrio. El departamento cuenta con una planta con una cómoda cocina integrada, living, comedor y una terraza super amplia (12m2) para poner parrilla, mesa y sillones. Cuenta además con un dormitorio en un altillo al que se accede por una escalera desde el living. En la planta baja cuenta con baño completo y toilette. Aa frio calor en los dos ambientes. Cuenta con amenities en la terraza común del edificio. Dos parrillas, pileta y laundry. Total: 62. 29m2financiamos tu compra. Consultanos.",,,,WhatsApp,Contactar,Besares 3100,62,1,1,,,
/propiedades/clasificado/veclapin-zapiola-4300-departamento-en-venta-con-renta-51373882.html,8,80000,USD,42000,$,"Saavedra, Capital Federal",35 m² tot.1 amb.1 baño1 coch.,"Zapiola 4300 / entre ruiz huidobro Y correa / venta con renta / monoambiente / contrafrente / dos años de antigÜedad / superificie total: 35 M2 / salida al balcón / vista al pulmón de manzana / cocina integrada / baño completo / pisos flotantes / ceramicos en cocina / muebles en alto Y balo mesada / cocina Y termotanque electrico / cochera fija cubierta para auto chico / terraza solarium de uso común / parrilla / laundry con maquina secarropas / expensas $ 42. 000 (mayo 2024) apto para personas con movilidad reducida - C. U. C. I. C. B. A. - Matricula Nº 597 -Nota importante: Toda la información y medidas provistas son aproximadas, deberán ratificarse con la documentación pertinente y no compromete contractualmente a nuestra empresa. Los gastos (expensas, abl) expresados refieren a la última información recabada y deberán confirmarse. Fotografías no vinculantes ni contractuales.",,,,WhatsApp,Contactar,Zapiola 4300,35,1,1,,1,
/propiedades/clasificado/veclapin-monoambiente-moderno-en-venta-en-saavedra-53004235.html,12,110000,USD,,,"Saavedra, Capital Federal",40 m² tot.1 amb.1 baño,"Moderno monoambiente en venta en el barrio de Saavedra. Ubicado en excelente zona residencial a una cuadra de la estación del fgbm, a metros de la Av. Roberto Goyeneche. Próximo a la Avenida Melián y al parque Saavedra, Con acceso a varias líneas de colectivos y salida rápida a la Avenida General Paz. La unidad es un monoambiente dividido con un placard para crear un área destinada al dormitorio, cocina integrada al living comedor, baño completo y balcón con cerramiento de vidrio. Se vende con RentaGran Oportunidad!! Para visitar contactate con nosotros!! *Las medidas y superficies expuestas surgen de la información suministrada por el propietario, la empresa no se responsabiliza por la exactitud de las mismas*. El valor consignado de las expensas mensuales (en caso que corresponda pago de expensas) están sujetos a verificación y/o ajustes. En el caso de tratarse de un inmueble en construcción los detalles de terminación y la fecha de entrega están sujetos a revisión. Las unidades publicadas están sujetas a disponibilidad. Casa Central: Av. Fleming 2800, Martínez Sucursal: Av. Del Libertador Ver datos, MartínezSucursal: Eduardo Costa 1804, Martínez Sucursal: Larrea 1381 2° A, cabahorario: Lunes a Viernes de 9 a 18 hs y Sábados 9 a 13 hs. carlos A. Bezruk Mat. 3275 cmsi. cucicba Mat. 5952",,,,WhatsApp,Contactar,Holmberg 4100,40,1,1,,,
/propiedades/clasificado/veclapin-venta-de-monoambiente-con-balcon-terraza.-apto-credito-55222554.html,18,86000,USD,95000,$,"Coghlan, Capital Federal",39 m² tot.1 amb.1 baño,"Excelente monoambiente a la venta en Coghlan Apto CréditoMonoambiente amplio y luminoso, ubicado al contrafrente. Balcón aterrazadoCocina con muebles bajo mesada, alacenas y barra desayunadora. Cocina de 4 hornallas a gas. Baño completo con ventilación naturalEspacio para lavarropas automáticoCaldera dual individual (baxi) Aire AcondicionadoAgua caliente individualEdificio de pocas unidades, estilo abierto y moderno con piscina, solarium, sum y parrillaNo dudes en coordinar tu visitacucicba Mat 7831 / cucicba Mat 8020&quot;Se encuentra prohibido cobrar comisiones inmobiliarias y gastos de gestoría de informes a los inquilinos que sean personas físicas. Para los casos de alquiler de vivienda, el monto máximo de comisión que se le puede requerir a los propietarios será el equivalente al cuatro con quince centésimos por ciento (4, 15%) del valor total del respectivo contrato&quot;. - (art. 5, Ley 5859) . Cumple con la ley de accesibilidad (art. 10 inc. 8 de la ley 2340) -La publicación de este inmueble es a título informativo, la venta de la propiedad está supeditada a que el propietario cumplimente el trámite ante la afip para la obtención del número de coti correspondiente. En cumplimiento de la leyes provinciales vigentes que regulan el corretaje inmobiliario, Ley Nacional 25. 028, Ley 22. 802 de Lealtad Comercial, Ley 24. 240 de Defensa al Consumidor, las normas del Código Civil y Comercial de la Nación y Constitucionales, los agentes/gestores no ejercen el corretaje inmobiliario, todas las operaciones inmobiliarias son concluidas por el martillero/corredor colegiado, cuyos datos se exhiben a continuación: Martilleras Responsables: María Virginia Zandueta cucicba Mat 7831 / cmcpsi 7066 y Sabrina Aldana Enrique cucicba Mat 8020 / cmcpsi 6814",,,,WhatsApp,Contactar,Gral. Ramón Freire al 2900,39,1,1,,,
/propiedades/clasificado/veclapin-departamento-monoambiente-en-venta-en-saavedra-50827526.html,20,90000,USD,6000,$,"Saavedra, Capital Federal",31 m² tot.1 amb.1 baño,"Excelente monoambiente en zona altamente solicitada de Saavedra. Increible opcion tanto como para vivir, como para inversion. Zona super tranquila, y a su vez inmediata a diferentes medio de transporte, ya que se encuentra tan solo a 4 cuadras de Av Cabildo y Congreso. Zona proxima a muchisimas areas verdes, ideal para vivir tranquilo/a. Inemjorable vista a la ciudad. Listo para ingresar, todos los papeles al dia. Instalaciones electricas, en cocina integrada al living. Baño completo con detalles en porcelanato. Cuenta con Laundry, terraza con parrilla, super amplia. Veni a conocerlo! / nota: Se deja constancia que las medidas, superficies, m2 y proporciones consignadas son aproximadas y pueden variar respecto del titulo de propiedad respectivo, al igual que las medidas parciales y/o de los ambientes están sujetas a verificación y/o ajuste sin comprometer a nuestra empresa. El valor indicado de expensas, si las hubiere, esta sujeto a variación. El precio del inmueble puede ser modificado sin previo aviso. Fotos de carácter no contractual. Todas las operaciones están a cargo de: Martillera Público Nancy Edith Moscovich. Matricula cmcpsi Nro. 1083. Martillera Melisa Yanet Buscaglia. Matricula cucicba Nro. 8702",,,,WhatsApp,Contactar,Moldes 3100,31,1,1,,,
/propiedades/clasificado/veclapin-venta-mono-ambiente-con-balcon-y-amenities-55531136.html,13,74000,USD,80000,$,"Saavedra, Capital Federal",32 m² tot.1 amb.1 baño,"Corredor Responsable: Diego Mastrangelo cucicba 7615 csi 6609- Contacto: Luciana Cruz Font. Lindísimo Mono ambiente de diseño único con balcón al frente y luz. En segundo piso, este lindísimo departamento de 32 metros totales, con diseño de vanguardia y en la mejor. zona de Saavedra. Tiene cocina independiente, balcón y baulera en el primer piso. El edidicio cuenta con un increíble jardín en el último piso con pileta, sum y parrilla. Es un edificio moderno, para disfrutar todo el año. Remax Argentina S. R. L. No ejerce el corretaje inmobiliario. El presente sitio web es una plataforma en donde cada oficina inmobiliaria independiente que contrata los servicios re/max puede publicar las propiedades a su cargo. Cada oficina es de propiedad y gestión independiente, por lo que Remax Argentina S. R. L no interviene en los datos de la publicación, en la operación inmobiliaria, ni en la confección y/o firma del boleto de compraventa y/o escritura y/o contrato de alquiler. En cumplimiento de las leyes vigentes que regulan el corretaje inmobiliario, Ley Nacional 25. 028, Ley 22. 802 de Lealtad Comercial, Ley 24. 240 de Defensa al Consumidor, las normas del Código Civil y Comercial de la Nación y Constitucionales, los agentes/gestores no ejercen el corretaje inmobiliario. Todas las operaciones inmobiliarias son objeto de intermediación y conclusión por parte del corredor público inmobiliario colegiado a cargo de la publicación, cuyos datos se exhiben en la presente. La presente publicación describe las características esenciales del inmueble, debiéndose consultar al corredor público inmobiliario responsable de la operación por la eventual actualización de las medidas, descripciones arquitectónicas y funcionales, valores de expensas, servicios, impuestos, precios y demás información, cuyos valores son aproximados. El inmueble no es accesible para personas con discapacidades físicas. Comprá la casa que querés! No la que podés. Accedé a un préstamo por hasta el 30% del valor de esta propiedad. Simulá tu cuota en Lendar",,,,WhatsApp,Contactar,Quintana 4500,32,1,1,,,
/propiedades/clasificado/veclapin-venta-departamento-a-estrenar-saavedra-55520223.html,20,122500,USD,63000,$,"Saavedra, Capital Federal",47 m² tot.1 amb.1 baño,"Corredor Responsable: uno bienes raices S. R. L. - nicolás sundblad cpi 7144 / csi 5821- Contacto: Dolores Padilla. en venta amplio departamento un ambiente amplio A estrenar. Excelente ubicación a metros de Av. General Paz, rápidos accesos a Zona Norte, barrio tranquilo con cercanía a grandes centros comerciales Shopping dot, Av Cabildo, Parque Saavedra. Edificio moderno con terminacion de alta calidad. Consta de dos cuerpos con cocheras en la plata baja. La unidad funcional se encuentra en el cuarto piso del segundo cuerpo. La misma es una unidad ampila de 43 metros facilmente divisible. Departamento con balcón. Cocina con muebles bajo mesada y alacenas con mucho lugar de guardado. Conexión para lavarropas o lavavajillas. Griferia fv. Aberturas de excelente calidad. Espacio para Dormitorio con placard. De amplias medidas. Cochera opcional en venta precio aparte del publicado. Consultar. Sum con parrilla, vistas abiertas y balcón aterrazado. Sala de reuniones o trabajo. Laundry en subsuelo. Dos cuerpos de 6 pisos y doble frente, separados por un vació de 9 x 17 metros. Planta baja libre, de acceso peatonal y cocheras. Núcleos de circulación independientes para las 20 unidades de cada bloque. 38 departamentos de dos ambientes y dos penthouses con terraza de 3 ambientes. Remax Argentina S. R. L. No ejerce el corretaje inmobiliario. El presente sitio web es una plataforma en donde cada oficina inmobiliaria independiente que contrata los servicios re/max puede publicar las propiedades a su cargo. Cada oficina es de propiedad y gestión independiente, por lo que Remax Argentina S. R. L no interviene en los datos de la publicación, en la operación inmobiliaria, ni en la confección y/o firma del boleto de compraventa y/o escritura y/o contrato de alquiler. En cumplimiento de las leyes vigentes que regulan el corretaje inmobiliario, Ley Nacional 25. 028, Ley 22. 802 de Lealtad Comercial, Ley 24. 240 de Defensa al Consumidor, las normas del Código Civil y Comercial de la Nación y Constitucionales, los agentes/gestores no ejercen el corretaje inmobiliario. Todas las operaciones inmobiliarias son objeto de intermediación y conclusión por parte del corredor público inmobiliario colegiado a cargo de la publicación, cuyos datos se exhiben en la presente. La presente publicación describe las características esenciales del inmueble, debiéndose consultar al corredor público inmobiliario responsable de la operación por la eventual actualización de las medidas, descripciones arquitectónicas y funcionales, valores de expensas, servicios, impuestos, precios y demás información, cuyos valores son aproximados. El inmueble no es accesible para personas con discapacidades físicas. Comprá la casa que querés! No la que podés. Accedé a un préstamo por hasta el 30% del valor de esta propiedad. Simulá tu cuota en Lendar",,,,,Contactar,Pinto 4700,47,1,1,,,
