url,POSTING_CARD_GALLERY,price_value,price_type,expenses_value,expenses_type,location,POSTING_CARD_FEATURES,description,CARD_FAV,POSTING_CARD_PUBLISHER,CARD_VIEWPHONE,CARD_WHATSAPP,CARD_CONTACT_MODAL,address,square_meters_area,rooms,bathrooms,phone,parking,bedrooms
/propiedades/clasificado/veclapin-venta-monoambiente-c-cochera-saavedra-55483492.html,20,95000,USD,140000,$,"Saavedra, Capital Federal",49 m² tot.1 amb.1 baño1 coch.,"Corredor Responsable: walter pascualini cpi 3763 / csi 5601- Contacto: Alfredo Agustin Seveso. Venta departamento Monoambiente con cochera en Saavedra. Caracteristicas: -Superficie total 49. 2 mts. - Cubierta. 42, 5 mts. - Balcon 4, 20 mts. - cochera fija descubierta. - piso de microcemento alisado. - cocina y horno electrico. - baño completo. -Toillete. - aberturas aluminio. -antiguedad 15 años. -expensas $140. 000 (incluye aysa) Ubicada a 5 cuadras de Av Cabildo, 4 cuadras de Av. Gral Paz, cercania con parques y gran variedad de transporte público. Remax Argentina S. R. L. No ejerce el corretaje inmobiliario. El presente sitio web es una plataforma en donde cada oficina inmobiliaria independiente que contrata los servicios re/max puede publicar las propiedades a su cargo. Cada oficina es de propiedad y gestión independiente, por lo que Remax Argentina S. R. L no interviene en los datos de la publicación, en la operación inmobiliaria, ni en la confección y/o firma del boleto de compraventa y/o escritura y/o contrato de alquiler. En cumplimiento de las leyes vigentes que regulan el corretaje inmobiliario, Ley Nacional 25. 028, Ley 22. 802 de Lealtad Comercial, Ley 24. 240 de Defensa al Consumidor, las normas del Código Civil y Comercial de la Nación y Constitucionales, los agentes/gestores no ejercen el corretaje inmobiliario. Todas las operaciones inmobiliarias son objeto de intermediación y conclusión por parte del corredor público inmobiliario colegiado a cargo de la publicación, cuyos datos se exhiben en la presente. La presente publicación describe las características esenciales del inmueble, debiéndose consultar al corredor público inmobiliario responsable de la operación por la eventual actualización de las medidas, descripciones arquitectónicas y funcionales, valores de expensas, servicios, impuestos, precios y demás información, cuyos valores son aproximados. El inmueble no es accesible para personas con discapacidades físicas. Comprá la casa que querés! No la que podés. Accedé a un préstamo por hasta el 30% del valor de esta propiedad. Simulá tu cuota en Lendar",,,,,Contactar,Arias 3000,49,1,1,,1,
/propiedades/clasificado/veclapin-excepc-amb-c-bcon-en-edif-estilo-ph-urbano.-pisc-55244501.html,20,76000,USD,74000,$,"Saavedra, Capital Federal",33 m² tot.1 amb.1 baño,Excepcional 1 amb en Edificio bajo estilo ph urbano Contrafrente con balcón y hermosa cocina completa con anafe y horno a gas tradicional y muy lndo baño completo. - Edificio chiquito con hermosa Terraza con hermosa piscina con deck de madera y solarium. - Sector de laudry. - Super luminoso. - Excelente ubicación a muy pocas cuadras del Parque Saavedra y a 1 cuadra de Av. Ricardo Balbin. Apto compra con créidito hpotecario Y/O blanqueo.,,,,WhatsApp,Contactar,Crisologo Larralde  al 4100 Crisologo Larralde  4100  Excepc 1 AMB Pasante Cfte C/bcon Estilo PR Urbano  Apto Crèdito Y AP Prof,33,1,1,,,
/propiedades/clasificado/veclapin-moderno-departamento-de-4-anos-excelente-ubicacion-a-54445501.html,20,83000,USD,,,"Saavedra, Capital Federal",32 m² tot.1 amb.1 baño,"¡Una oportunidad única en excelente ubicación! Este hermoso departamento, ubicado en un edificio de solo 4 años de antigüedad, ofrece lo mejor en confort y modernidad. A solo metros de Av. Balbín y la estación de tren, disfrutarás de muy buenos accesos que conectan rápidamente con toda la ciudad. El inmueble cuenta con un amplio ambiente que se integra perfectamente con la cocina de estilo abierto, creando un espacio ideal para vivir cómodamente. El balcón ofrece una vista despejada hacia el pulmón de manzana, lo que aporta tranquilidad y privacidad, además de contar con una excelente iluminación natural que resalta cada rincón. El departamento dispone de un amplio placard para un perfecto aprovechamiento del espacio y un baño compartimentado de diseño moderno y funcional, pensado para tu comodidad. Con tan solo 4 años de antigüedad, este departamento se encuentra en perfecto estado y es una excelente inversión tanto para vivir como para alquilar, gracias a su inmejorable ubicación y su diseño funcional y contemporáneo. ¡No dejes pasar esta oportunidad de vivir en un lugar cómodo, moderno y perfectamente conectado!",,,,WhatsApp,Contactar,Manzanres al 3900,32,1,1,,,
/propiedades/clasificado/veclapin-moderno-amb.-al-contrafrente-en-impecable-estado-55343153.html,22,99000,USD,83969,$,"Saavedra, Capital Federal",33 m² tot.1 amb.1 baño1 coch.,"Moderno Amb. Al Contrafrente en Impecable EstadoModerno Amb. De 7, 06x3, 4m piso de porcelanato con placard y aire acondicionado frio/calor; Balcón de 3, 4x1, 05m; la Cocina con muebles completos de alacenas y bajo mesada que esta integrada al Amb. ; cómodo Baño con ducha y ventana al exterior; Cochera cubierta fija. Detalles adicionales: Mucha luz, tiene termotanque eléctrico, espacio para lavarropas y/o lavavajillas. estimado colega, consultar al asesor cuanto se comparte de comision por la propiedadlas medidas son aproximadas y al solo efecto orientativo. Las medidas reales surgirán del título de propiedad respectivo. En el caso que corresponda el pago de las expensas mensuales están sujeto a modificación y/o ajustes, El precio del inmueble puede ser modificado sin previo aviso. Las fotos y videos anunciados son de carácter no contractual. Certificado de registro vehículo aéreo no tripulado vnt-812C. A. Castaño Martillero y Corredor Público Colegiado S. I. 3184 y 3322. M. A. Castaño Matricula Corredor Inmobiliario cucicba Nro 6467. Carlos Castaño Propiedades sas.",,,,WhatsApp,Contactar,Gral. Ramon Freire al 3500,33,1,1,,1,
/propiedades/clasificado/veclapin-monoambiente-en-venta-saavedra-50-m-sup2--amenities-55461711.html,23,115000,USD,66000,$,"Saavedra, Capital Federal",50 m² tot.1 amb.1 baño,"Corredor Responsable: Fernando Muñoz cucicba 6573 / pablo daniel vicente cmcpsi 6437- Contacto: Paola Roxana Correa. en venta increible monoambiente divisible con balcón. 50 M2 totales. Apto vivienda Y profesional. apto credito. - Moderno Monoambiente Divisible con Balcón Este atractivo monoambiente divisible, que se destaca por su diseño contemporáneo y funcionalidad, ofrece la comodidad de un dos ambientes en un solo espacio. Con un generoso metraje, el departamento cuenta con una distribución versátil que permite una separación efectiva del área de descanso y el área de estar, adaptándose a tus necesidades. Características principales: Ventanas y Luminosidad: Dispone de una amplia ventana al pulmón del edificio y otra puerta ventana corrediza al frente, proporcionando una excelente circulación de aire y una abundante entrada de luz natural durante todo el día. Balcón: Disfruta de un encantador balcón al frente, perfecto para relajarse al aire libre y aprovechar el espacio adicional para disfrutar de tu entorno. Espacio Divisible: La posibilidad de dividir el espacio en áreas funcionales permite crear un área de dormitorio separada del área de estar, ofreciendo flexibilidad y privacidad. Este monoambiente divisible combina la funcionalidad de un departamento de dos ambientes con el encanto y la practicidad de un diseño moderno, brindándote un hogar ideal para vivir cómodamente y disfrutar de un ambiente luminoso y contemporáneo. El Edificio cuenta con: sum. piscina. solarium con duchas. laundry. ¡Vení a visitarlo y enamórate! Comunícate para coordinar tu visita. Remax Argentina S. R. L. No ejerce el corretaje inmobiliario. El presente sitio web es una plataforma en donde cada oficina inmobiliaria independiente que contrata los servicios re/max puede publicar las propiedades a su cargo. Cada oficina es de propiedad y gestión independiente, por lo que Remax Argentina S. R. L no interviene en los datos de la publicación, en la operación inmobiliaria, ni en la confección y/o firma del boleto de compraventa y/o escritura y/o contrato de alquiler. En cumplimiento de las leyes vigentes que regulan el corretaje inmobiliario, Ley Nacional 25. 028, Ley 22. 802 de Lealtad Comercial, Ley 24. 240 de Defensa al Consumidor, las normas del Código Civil y Comercial de la Nación y Constitucionales, los agentes/gestores no ejercen el corretaje inmobiliario. Todas las operaciones inmobiliarias son objeto de intermediación y conclusión por parte del corredor público inmobiliario colegiado a cargo de la publicación, cuyos datos se exhiben en la presente. La presente publicación describe las características esenciales del inmueble, debiéndose consultar al corredor público inmobiliario responsable de la operación por la eventual actualización de las medidas, descripciones arquitectónicas y funcionales, valores de expensas, servicios, impuestos, precios y demás información, cuyos valores son aproximados. El inmueble es accesible para personas con discapacidades físicas. Comprá la casa que querés! No la que podés. Accedé a un préstamo por hasta el 30% del valor de esta propiedad. Simulá tu cuota en Lendar",,,,,Contactar,Pinto 4600,50,1,1,,,
/propiedades/clasificado/veclapin-38-m-monoambiente-con-balcon-baulera-amenities-54858031.html,17,88500,USD,60000,$,"Coghlan, Capital Federal",38 m² tot.1 amb.1 baño,"Amplio monoambiente con balcón situado en un 3° piso a la calle, que posee una superficie total de 38 metros cuadrados. Cuenta con una baulera jaula en el subsuelo del edificio. Unidades apto profesional. Edificio moderno con muchos amenities. Piscina amplia con solárium, sector de parrilla al aire libre, laundry, sum equipado para 20/25 personas con cocina propia. El departamento posee su ambiente principal con pisos de madera, un placard empotrado, y una cocina integrada al mismo con muebles bajo y alto mesada, cocina y anafe eléctrico, espacio para la heladera, el lavarropas, y el termotanque eléctrico. Cuenta con un baño completo con bañadera de buenas dimensiones. Orientación oeste, es muy luminoso. Las expensas actualizadas son por un valor de $60. 000. Ubicado a tan solo 200m de las avenidas Monroe, Congreso y Dr. Ricardo Balbín; y a 300 metros del Hospital Pirovano y de la estación de tren “Coghlan” del ramal Mitre. Sebastian spennato propiedades. Matrícula cucicba cpi Nº 6479",,,,WhatsApp,Contactar,Pedro I. Rivera 3400 - 3°,38,1,1,,,
/propiedades/clasificado/veclapin-departamento-de-1-ambiente-super-luminoso!-51921733.html,16,79900,USD,,,"Saavedra, Capital Federal",36 m² tot.1 amb.1 baño,"Departamento de 1 ambiente al contrafrente con balcón super luminoso!, orientación oeste, edifcio de 5 años de antigüedad de muy buena calidad, amplios ventanales hacia balcón, baño completo con vanitory, cocina con espacio para lavarropas y con barra, excelente estado. Nota: La información gráfica y escrita contenida en el presente aviso es meramente orientativa y no compromete contractualmente a nuestra empresa. Las medidas y superficies definitivas surgirán del título de propiedad del inmueble referido. El valor del inmueble indicado en el presente puede ser modificado sin previo aviso. Información adicional: Aire acondicionado. Permite mascotas. Luminosidad: Muy luminoso. Corredor Inmobiliario Responsable. Lic. Gabriela N. Lassig. cpi 5530. Nota: La información gráfica y escrita contenida en el presente aviso es meramente orientativa y no compromete contractualmente a nuestra empresa. Las medidas y superficies definitivas surgirán del título de propiedad del inmueble referido. El valor del inmueble indicado en el presente puede ser modificado sin previo aviso. Ley 5115: excepto que en la descripción de la propiedad se indique lo contrario, el edificio puede no contar con rampa para personas con movilidad reducida, y no ser accesible para personas con discapacidades físicas. -",,,,WhatsApp,Contactar,Quintana  4600,36,1,1,,,
/propiedades/clasificado/veclapin-monoambiente-amoblado-con-balcon.-55559239.html,20,79000,USD,70000,$,"Saavedra, Capital Federal",33 m² tot.1 amb.1 baño,"Corredor Responsable: Hernán Martin Carbone cpi 5493 / Gabriel Carlos Monrabal cmcpsi 6341- Contacto: Lucas Germán Archelli. Departamento monoambiente en el barrio de Saavedra, Próximo al Parque Sarmiento. Se trata de un departamento en tercer piso, completamente amoblado. Cocina con muebles completos, y barra desayunador. Ambiente cómodo con salida al balcón y división modular para la habitación, amplio placard. Baño completo. Ideal inversor. Alquilado hasta Febrero 2025. Remax Argentina S. R. L. No ejerce el corretaje inmobiliario. El presente sitio web es una plataforma en donde cada oficina inmobiliaria independiente que contrata los servicios re/max puede publicar las propiedades a su cargo. Cada oficina es de propiedad y gestión independiente, por lo que Remax Argentina S. R. L no interviene en los datos de la publicación, en la operación inmobiliaria, ni en la confección y/o firma del boleto de compraventa y/o escritura y/o contrato de alquiler. En cumplimiento de las leyes vigentes que regulan el corretaje inmobiliario, Ley Nacional 25. 028, Ley 22. 802 de Lealtad Comercial, Ley 24. 240 de Defensa al Consumidor, las normas del Código Civil y Comercial de la Nación y Constitucionales, los agentes/gestores no ejercen el corretaje inmobiliario. Todas las operaciones inmobiliarias son objeto de intermediación y conclusión por parte del corredor público inmobiliario colegiado a cargo de la publicación, cuyos datos se exhiben en la presente. La presente publicación describe las características esenciales del inmueble, debiéndose consultar al corredor público inmobiliario responsable de la operación por la eventual actualización de las medidas, descripciones arquitectónicas y funcionales, valores de expensas, servicios, impuestos, precios y demás información, cuyos valores son aproximados. El inmueble no es accesible para personas con discapacidades físicas. Comprá la casa que querés! No la que podés. Accedé a un préstamo por hasta el 30% del valor de esta propiedad. Simulá tu cuota en Lendar",,,,WhatsApp,Contactar,Pico 4800,33,1,1,,,
/propiedades/clasificado/veclapin-comodo-monoambiente-con-balcon-al-frente-apto-credito-54916648.html,9,79000,USD,,,"Saavedra, Capital Federal",38 m² tot.1 amb.1 baño,Monoambiente con balcón al frente con vista abierta. Ideal para inversión de renta. Amplio ambiente cocina con Barra.,,,,WhatsApp,Contactar,Romulo Naon 3675,38,1,1,,,
/propiedades/clasificado/veclapin-saavedra-dto-43617361.html,11,98000,USD,,,"Saavedra, Capital Federal",34 m² tot.1 amb.1 baño1 coch.,"Monoamb al Frente con Balcón, Espacio guardacoche, Ambiente Amplio, Muy Luminoso, Vista Abierta, Cocina integrada al frente del ambiente c/ventana Placard doble con interiores, Baño completo c/bañera, Terraza común en ultimo piso. Cerca estación Saavedra, Av Gral Paz, Av Panamericana y de Shopping Dot a dos cuadras Parque Sarmiento y cerca Parque Saavedra Gran pulmón Verde. Se vende con renta. Para ver llamar al Ver datos cel whatsapp o contactarse a Ver datos",,,,,Contactar,Miller 4400,34,1,1,,1,
/propiedades/clasificado/veclapin-av-ruiz-huidobro-4600-saavedra-1amb-u$85.000-55256429.html,10,85000,USD,45000,$,"Saavedra, Capital Federal",36 m² tot.1 amb.1 baño,"Apto crédito. Monoambiente nuevo, al frente. 2º piso. Superficie total de 36m², cubierta de 31m² y descubierta de 5m². Cocina eléctrica incorporada, baño completo. Balcón. Ventanas con doble vidriado. Excelente estado, muy luminoso. Pisos de cerámica. Orientación norte. Espacio para lavarropas carga frontal en el baño (queda cubierto por un mueble). Edificio de 9 pisos, 2 departamentos por piso. 1 ascensor. Expensas $45. 000 (enero 2025). Portero eléctrico con cámara y código numérico para ingresar. Está alquilado hasta fin de Marzo 2025. Agua caliente central. Sin encargado, empresa de limpieza. Colectivos: 21, 28, 29, 41, 67, 71, 76, 93, 110, 117, 130. xintel(frc-frc-7107)",,,,WhatsApp,Contactar,Dirección no informada,36,1,1,,,
/propiedades/clasificado/veclapin-venta-monoambiente-divisible-al-frente-55352491.html,12,105000,USD,,,"Coghlan, Capital Federal",31 m² tot.1 amb.1 baño,"Hermoso, súper luminoso, ventilado monoambiente divisible de 31 m2. Con frente a la calle Manuela Pedraza. 5 años de antigüedad. Ya escriturado! Agua caliente central. Eléctrico (sin gas). Sin encargado. Edificio de 4 pisos, 4 unidades por piso. Ascensor. Palieres abiertos. Muy luminoso. Tranquilo. Ventilación cruzada ya que por la disposición de la unidad cuenta con un ingreso muy privado que aplica como segundo balcón por la construcción moderna del Edificio. Orientación Noreste. Agua caliente central por caldera de gas en el edificio. A una cuadra de Av. Balbín con todos los comercios a disposición. Cerca de la estación de Coghlan (800m) | 12 calles de Cabildo. Colectivos 67, 76, 130. Rápido acceso a zona Norte de gba (Panamericana y General Paz). Cocina eléctrica de 4 hornallas con horno convección. Pre instalación para Aire acondicionado. Lavarropas bajo mesada. Baño completo con bañadera. Vanitory. Espejo. Muy amplio y cómodo. La información gráfica y escrita contenida en el presente aviso es meramente a título estimativo y no forma parte de ningún tipo de documentación contractual. Las medidas y superficies definitivas surgirán del título de propiedad del inmueble referido. Parcialmente apto personas con movilidad reducida Ley 5115. Asimismo, los importes de impuestos, tasas, servicios y expensas aquí indicados están sujetos a verificación por parte del potencial comprador. El valor del inmueble indicado en el presente puede ser modificado sin previo aviso. Operación supeditada a que el propietario cumplimente con la R. G. N° 2371/07 coti. - kpVer datos - kpdVer datos- - Publicado vía KiteProp crm Inmobiliario.",,,,WhatsApp,Contactar,Pedraza 3700,31,1,1,,,
/propiedades/clasificado/veclapin-departamento-monoambiente-divisible-muy-luminoso-55533851.html,16,95000,USD,57664,$,"Saavedra, Capital Federal",55 m² tot.1 amb.1 baño,"Monoambiente divisible muy luminoso apto profesional. Con fácil acceso a Av. General Paz y Panamericana. Cerca de dot Baires Shopping. Apto profesionalmedidas: - Balcón: 8. 66x1. 97- Ambiente: 8. 66x3. 30- Baño: 2. 46x1. 63Expensas Octubre 2024: $57. 664 (Incluye Aysa). Aire Acondicionado bgh frío/calor. Termotanque saiar. Conexión para lavarropas. Las medidas, superficies y expensas consignados en la presente son aproximados y no resultan vinculantes. Los datos definitivos son los que surgen del título de propiedad. Más información: Tel. :Ver datos – Ver datos",,,,WhatsApp,Contactar,Donado al 4400,55,1,1,,,
/propiedades/clasificado/veclapin-venta-departamento-monoambiente-con-cochera-fija-55380473.html,14,95000,USD,,,"Saavedra, Capital Federal",40 m² tot.1 amb.1 baño,"En venta hermoso departamento monoambiente con cochera fija Y cubierta balcon corrido al frente cocina con mobiliario completo bajo Y sobre mesada artefacto cocina A gas, 4 hornallas + horno planta de 4X8 baño completo (con bañera Y mampara) placards se encuentra instalado aire acondicionado tipo &quot;split&quot; el edificio cuenta con ascensor y laundry (lavadero uso comun con artefacto de lavado Y secado) ubicado A metros de avenida triunvirato Y galvan. - Si buscas vender o comprar, Estamos para ayudarte! Para Vender, coordinamos una Tasación sobre tu inmueble y dentro de las 24hs tendrás el valor real para el mercado actual; Para Comprar, te asignamos un Asesor el cual te acompañara en la búsqueda de tu Próxima Vivienda; Llámanos y hace Realidad tu sueño! De paola propiedades martillera responsable tatiana de paola cmcpsi 6308",,,,WhatsApp,Contactar,Larralde al 5100,40,1,1,,,
/propiedades/clasificado/veclapin-departamento-de-un-ambiente-en-coghlan-55089254.html,9,105000,USD,3500,$,"Coghlan, Capital Federal",41 m² tot.1 amb.1 baño,"Un ambiente en Coghlan! Descripción: Divino monoambiente con balcón que da al contrafrente. Cocina integrada al living. Baño completo. Aire acondicionado frio/calor. No hay encargado en el edificio. El edificio tiene 7 pisos. Son dos departamentos por piso. No es apto profesional. Valor de venta expresado en dólares. cucicba Mat N° 6950Las medidas y superficies expuestas surgen de la información suministrada por el propietario, la empresa no se responsabiliza por la exactitud de las mismas. La publicación de este inmueble es a solo título informativo, pues la venta de la propiedad está supeditada a que el propietario cumplimente el trámite ante la afip para la obtención del Número de coti correspondiente.",,,,WhatsApp,Contactar,Freire  2500,41,1,1,,,
/propiedades/clasificado/veclapin-nuevo!-en-edificio-de-categoria-con-amplio-espacio-51025613.html,20,109000,USD,9000,$,"Coghlan, Capital Federal",42 m² tot.1 amb.1 baño,"Edificio sobre doble frente, construcción de categoría Y excelente calidad. Optima ubicación, próximo a Av. Cabildo y Subte linea ""D"" Gran expansión libre en planta baja, con piscina, solarium, parrillas y S. U. M. Ultimas Unidades disponibles en 3er y 4to piso - Bien equipado, con balcón corrido - Cocina integrada con desayunador y lavadero - Baño completo. - Totem de seguridad y empresa de limpieza. - Servicios individuales. Nuestro Instagram! @castillo. props",,,,WhatsApp,Contactar,CRAMER 3000,42,1,1,,,
