url,POSTING_CARD_GALLERY,price_value,price_type,expenses_value,expenses_type,location,POSTING_CARD_FEATURES,description,CARD_FAV,POSTING_CARD_PUBLISHER,CARD_VIEWPHONE,CARD_WHATSAPP,CARD_CONTACT_MODAL,address,square_meters_area,rooms,bathrooms,phone,parking,bedrooms
/propiedades/clasificado/veclapin-moderno-ambiente-con-balcon-100-luz-y-sol-corredor-55385573.html,19,93000,USD,76000,$,"Coghlan, Capital Federal",36 m² tot.1 amb.1 baño,"Donado entre la pampa Y virrey del pino - belgrano / villa ortuzar / nuevo barrio doho! Con una excelente ubicación, barrio en constante crecimiento, característico por sus edificaciones bajas y nuevo polo gastronómico. A solo dos cuadras de Av. De Los Incas y Av. Álvarez Thomas, de fácil acceso. Cuenta con: - Amplio ambiente apaisado con salida a balcón corrido- Cocina integrada (artefacto eléctrico), mucho espacio de guardado- Conexión para lavarropas- Baño con ducha- Balcón con vista abiertaCaracterísticas generales, - Pisos de porcelanato- Sol de tarde, muy luminoso- Pre-instalación de aire acondicionado - Calefacción individual y agua caliente por termotanque. - Edificio de 5 pisos, 4 departamentos por piso. disponible",,,,WhatsApp,Contactar,Donado 1755,36,1,1,,,
/propiedades/clasificado/veclapin-venta-monoambiente-a-estrenar-saavedra-55508961.html,30,87000,USD,80000,$,"Saavedra, Capital Federal",32 m² tot.1 amb.1 baño,"Venta coqueto monoambiente en el barrio de Saavedra, apto Blanqueo, apto profesional. Pisos de madera, placard de piso a techo, mesada de Silestone, balcón aterrazado con vista abierta al frente, ubicado en el 3er. Piso, de un edificio moderno con áreas abiertas, jardín central, sector de coworking totalmente equipado en medio de un ambiente agreste con mucha vegetación, Esta ubicado a metros de la Av. Balbín, con todos los medios de transporte, a 3 cuadras de la estación Tronador del ferrocarril Mitre, a 2 cuadras del Parque Saavedra, en un barrio en plena expansión. A metros de 2 pequeños centros comerciales. Entre Núñez y Crisologo Larralde. Digno de Visitar. Todas las medidas son aproximadas al solo efecto orientativo. Las medidas exactas serán las que surjan del título de propiedad. Las fotografías y videos no son contractuales. No se encuentran incluidos en el precio publicado los equipos de aire acondicionado, electrodomésticos, artefactos de iluminación ni accesorios que pudieran estar mencionados en la descripción o ilustrados en fotografías. Únicamente quedarán incluidos en el precio aquellos ítems que surjan de la reserva a conformar entre las partes. Si hubiera valores de expensas y/o impuestos detallados, los mismos son aproximados y sujetos a modificación. En caso de venta, la operación está sujeta a la tramitación del Código de Oferta de Transferencia de Inmuebles (coti) por parte del propietario. La intermediación y la conclusión de las operaciones son llevadas a cabo por los profesionales matriculados de premier real estate S. A. M. Annoni cucicba 6771 - P. Kaminsky cucicba 7753/cmcpsi 6665. Cada Oficina es de Propiedad y Operación Independiente.",,,,WhatsApp,Contactar,JARAMILLO 3744,32,1,1,,,
/propiedades/clasificado/veclapin-departamento-monoambiente-venta-saavedra-54660878.html,15,90000,USD,70000,$,"Saavedra, Capital Federal",33 m² tot.1 amb.1 baño,"¡Vení a conocer tu nuevo hogar en una excelente zona de la ciudad! Este hermoso monoambiente con balcón al frente te ofrece todo lo que necesitas para vivir cómodo y feliz. Gracias a su orientación Norte, el departamento recibe una increíble cantidad de luz natural durante todo el día, haciendo que el espacio se sienta cálido y acogedor. Además, tiene la posibilidad de dividirse fácilmente y convertirlo en dos ambientes sin perder su luminosa característica. Cuenta con un práctico placard empotrado con interiores bien organizados, una cocina semi integrada con barra desayunadora, y mucho espacio de almacenamiento con alacenas y bajo mesada. El baño completo está separado del área principal, lo que te brinda más comodidad y privacidad. El balcón con tiene vista abierta, donde la tranquilidad y la seguridad están garantizadas por las rejas de protección. La zona es excelente, con accesos muy cómodos hacia cualquier dirección, con Parque Sarmiento a menos de dos cuadras donde se encuentra muchísimo verde y puntos gastronómicos además de buenos comercios y medios de transporte. cucicba 5147&quot;Se deja constancia que los m2 y la antigüedad son aproximados, al igual que las medidas parciales y el valor consignado de las expensas mensuales (en caso que corresponda pago de expensas) están sujetos a verificación y/o ajustes, el precio del inmueble puede ser modificado sin previo aviso. En el caso de tratarse de un inmueble en construcción los detalles de terminación y la fecha de entrega están sujetos a revisión. Fotos de carácter no contractual. Las unidades publicadas están sujetas a disponibilidad. Dic propiedades S. A. Actúa solamente en carácter de comercializadora de los inmuebles ofrecidos. En caso de tratarse de un terreno, la información de m2 construibles es orientativa, debiendo ser constatada por el interesado. &quot;Código de propiedad: dapVer datosJavier Del Coro Igarzabal cmcpsi Mat Nº 4499 María Amparo Coello cuciba Mat N° 5147dic propiedades S. A. - www. dicpropiedades. com. ar",,,,WhatsApp,Contactar,Pico al 4800 Entre Valdenegro y Miller,33,1,1,,,
/propiedades/clasificado/veclapin-venta-departamento-monoambiente-saavedra-con-cochera-53404322.html,10,92000,USD,93000,$,"Saavedra, Capital Federal",40 m² tot.1 amb.1 baño1 coch.,"Saavedra - muy buen acceso a Gral Paz - a 300 mts de Av. Galván. Ubicado en zona de casas y construcciones bajas. Hace que este departamento tenga mucha luz y lindas vistas. se vende con renta hasta nov 2025Edificio de aproximandamente 10 años. Departamento ubicado en el primer piso al frente, muy luminoso con orientación norte. Sol de tarde. Apto crédito, primera escritura. Monoambiente dividido con un mueble utilizable como modular para el living y como placard para el dormitorio. Living comedor con la cocina integrada, muebles alto y bajo mesada en melamina blanca, baño completo y salida al balcon mediante gran ventanal. Cochera cubierta. El edificio bajo, de pocas unidades, cuenta con laundry, porton automatico de ingreso vehicular. Terminaciones: Cocina electrica. Calefaccion por aire frio calor. Expensas $93. 000 noviembre 2024 Martilleros Responsables: Analía Zárate Matrícula Profesional cmcpsi 6238 - Andrés Zárate Matrícula Profesional cucicba 8812. Todas las medidas enunciadas son meramente orientativas, las medidas exactas serán las que se expresen en el respectivo título de propiedad de cada inmueble. Todas las fotos, imágenes y videos son meramente ilustrativos y no contractuales. La información publicada podrá sufrir cambios y/o actualizaciones. Los precios enunciados son meramente orientativos y no contractuales. © zgi Ver datos.",,,,WhatsApp,Contactar,Ruiz Huidobro 4548 Caba,40,1,1,,1,
/propiedades/clasificado/veclapin-ph-monoambiente-en-venta-1-bano-43-m-sup2--55238904.html,24,75000,USD,,,"Saavedra, Capital Federal",43 m² tot.1 amb.1 baño,"_ ph monoambiente en venta ubicado sobre calle Mariano Acha entre Ruiz Huidobro y Besares (Saavedra, Ciudad Autónoma de Buenos Aires). Desarrollado en piso bajo por escalera, con disposición frente y orientación norte. _ El mismo posee cocina equipada con muebles bajo mesada con espacio y conexión para lavarropas integrada a un espacio principal y un baño completo. Luminoso, cuenta con balcón y equipo de aire acondicionado. _ La propiedad tiene una superficie total aproximada de 43mts2, de los cuales 41mts2 son cubiertos. Yacoub | Construimos ConfianzaInnovación | Calidad | Sustentabilidad | Diseño70 Mil Metros Cuadrados | 19 Torres La información descripta en el presente aviso es meramente orientativa y no forma parte de ningún tipo de documentación contractual. Los datos enunciados fueron proporcionados por los propietarios y pueden arrojar inexactitudes, las superficies definitivas surgirán del título de propiedad del inmueble referido. Se deja constancia de que los valores y/o expensas pueden estar sujetas a verificación o ajuste. Lo que estás buscando lo tenemos | Estés Donde EstésVendemos en Todos Lados",,,,WhatsApp,Contactar,Mariano Acha e/ Ruiz Huidobro y Besares,43,1,1,,,
/propiedades/clasificado/veclapin-venta-dpto-monoambiente-con-terraza-propia-y-cochera-53223992.html,16,103000,USD,51000,$,"Coghlan, Capital Federal",68 m² tot.1 amb.1 baño,"Este exclusivo monoambiente al contrafrente destaca por su confort y calidad en cada detalle. Cuenta con una amplia terraza propia de 30 m², ideal para disfrutar de espacios al aire libre. El departamento está equipado con un anafe y horno eléctrico de alta gama, garantizando una experiencia de cocina excepcional. El baño completo, de diseño moderno y funcional, aporta comodidad adicional. Además, dispone de una cochera cubierta propia que añade valor y practicidad. Se encuentra con renta vigente hasta agosto de 2026, lo que lo convierte en una oportunidad única tanto para inversores como para quienes busquen un lugar de calidad para vivir. ¡Un departamento difícil de encontrar con estas características! Nota: La información gráfica y escrita contenida en el presente aviso es meramente a título estimativo y no forma parte de ningún tipo de documentación contractual. Las medidas y superficies definitivas surgirán del título de propiedad del inmueble referido. Asimismo, los importes de impuestos, tasas, servicios y expensas aquí indicados están sujetos a verificación por parte del potencial comprador. Raquel torres parra desarrollos urbanos",,,,WhatsApp,Contactar,Pedraza Manuela al 3800 Entre Melian AV. y Washington,68,1,1,,,
/propiedades/clasificado/veclapin-departamento-belgrano-55324760.html,29,109000,USD,115000,$,"Coghlan, Capital Federal",44 m² tot.1 amb.1 baño,"Excelente monoambiente con amenities! piso alto, muy luminoso. vistas abiertas! Impecable monoambiente divisible. Ambiente principal de 3. 10 x 9 con placard de guardado. Buen balcón con vistas abiertas. Cocina semi integrada con barra desayunadora de madera, anafe y horno eléctrico italianos marca Glem. Calefacción por piso radiante eléctrico regulable. Baño completo con bañera y grifería ferrum. Agua caliente central. . Roosevelt Park es un complejo de ocho plantas de departamentos de uno, dos y tres ambientes. Cuenta con sum y parrilla en el piso 9; y solarium más pileta en el piso 10. Roosevelt Park se encuentra a tan sólo seis cuadras de la estación de tren de Coghlan, a la cual debe su nombre. La zona de la estación del ferrocarril cuenta con protección patrimonial, que tanto valor le da al barrio y que es su casco histórico. A 8 cuadras de av. Cabildo, subte linea D y Metrobus. A 2 cuadras de av. Balbín. Cómoda accesibilidad a Zona Norte y General Paz. Sup. Cubierta 40 m2Sup. Descubierta 4 m2Apto Profesional. Apto crédito. Sabatini Negocios InmobiliariosAv. Cabildo 790Tel. : Ver datos /Ver datosVer datos tomamos su propiedad en parte de pago. aviso legal Las medidas son aproximadas, las reales surgen del titulo de propiedad o plano de mensura. Las imágenes son a mero título ilustrativo. Las descripciones y valores de expensas, impuestos y servicios son aproximados y fueron proporcionados por el propietario y pueden no estar actualizados a la hora de la visualización de este aviso",,,,WhatsApp,Contactar,Roosevelt al 3300,44,1,1,,,
/propiedades/clasificado/veclapin-venta-de-departamento-1-ambiente-en-saavedra-capital-55432222.html,16,89000,USD,75000,$,"Coghlan, Capital Federal",38 m² tot.1 amb.1 baño,"Venta de Departamento 1 ambiente en Saavedra, Capital Federal. apto credito/apto profesional/apto blanqueo. Amplio y luminoso monoambiente, piso alto con un gran balcón aterrazado, cocina integrada, al frente, con vista abierta. El departamento se encuentra en el 4to. Piso de un edificio de tan solo 7 pisos, tranquilo en una zona en pleno crecimiento del barrio de Saavedra, a 4 cuadras del Parque Saavedra, a 1 cuadra de la Av. Ricardo Balbín con todos los medios de transporte, a 2 cuadras de la Estación Saavedra del ferrocarril Mitre, y en el medio de dos pequeños centros comerciales; y Gimnasio, sobre la calle Rómulo Naon entre Larralde y Núñez. El departamento esta construido con detalles de categoría, mesada de Silestone, Anafe y horno eléctrico marca Orbis. Pisos de porcelanato ilva, digno de Ver. Todas las medidas son aproximadas al solo efecto orientativo. Las medidas exactas serán las que surjan del título de propiedad. Las fotografías y videos no son contractuales. No se encuentran incluidos en el precio publicado los equipos de aire acondicionado, electrodomésticos, artefactos de iluminación ni accesorios que pudieran estar mencionados en la descripción o ilustrados en fotografías. Únicamente quedarán incluidos en el precio aquellos ítems que surjan de la reserva a conformar entre las partes. Si hubiera valores de expensas y/o impuestos detallados, los mismos son aproximados y sujetos a modificación. En caso de venta, la operación está sujeta a la tramitación del Código de Oferta de Transferencia de Inmuebles (coti) por parte del propietario.",,,,WhatsApp,Contactar,ROMULO NAÓN 3561,38,1,1,,,
/propiedades/clasificado/veclapin-monoambiente-con-balcon-en-coghlan!-55542667.html,11,105000,USD,110000,$,"Coghlan, Capital Federal",39 m² tot.1 amb.1 baño,"Monoambiente con Balcón en Coghlan! Roosevelt 3200M2 Cubiertos: 36M2 Totales: 39Living Comedor con salida al balcón. Cocina integrada eléctrica con barra desayunadora. Baño completo. Posibilidad de venta amoblado! ! Calefacción por Losa radiante. Aire Acondicionado frio/calor. Agua caliente central. Edificio de 8 pisos, 4 unidades por piso, 1 ascensor. Cuenta con Laundry y Solárium. Excelente Ubicación! A una cuadra de Av. Balbín, de Av. Monroe y a tres cuadras de Av. Congreso. Cercanía con variedad de líneas de colectivo y estación del Tren Mitre. Apto Profesional. Apto Crédito. Apto AirBnb. Matias Psevoznik matrícula cucicba N° 7733Aviso legal: Las medidas, superficies y proporciones consignadas son aproximadas y al sólo efecto orientativo y pueden variar respecto del plano y titulo de propiedad respectivos, al igual que las medidas parciales y/o de los ambientes que están sujetas a verificación y/o ajuste. - El valor indicado de expensas, si las hubiere, está sujeto a variación. - Los valores pueden ser modificados sin previo aviso. - Las fotos publicadas son ilustrativas, no contractuales y propiedad de Tovado Propiedades. -.",,,,WhatsApp,Contactar,Roosevelt 3200,39,1,1,,,
/propiedades/clasificado/veclapin-departamento-en-saavedra-55614044.html,29,86000,USD,95000,$,"Saavedra, Capital Federal",38 m² tot.1 amb.1 baño,"Monoambiente en Saavedra se Vende! con amplio balcón al frente super verde; vista abierta. Buena distribución, muy cómodo. Baño completo, placard y cocina con anafe y horno eléctrico. Preinstalación de aire acondicionado. Edificio moderno, 5 años de antiguedad. Diseño y calidad constructiva. Cuenta con solarium con duchas de uso común en la terraza del 7mo piso. Laundry, baños y bicicleteros en la pb. Excelente ubicación! Naon y Balbín; a 5 cuadras del parque Saavedra. Muy buena conectividad con la ciudad y el acceso Norte. Barrio residencial en pleno crecimiento y desarrollo. Ideal para vivir y/o renta. Aviso legal: Se hace saber que las características descriptas del inmueble publicado, calidades y cualidades constructivas y funcionales, valores de expensas, impuestos y servicios, y medidas y superficies, son aproximados y consignadas en base a datos que fueron proporcionados por el propietario y que pueden no ser exactos y/o no estar actualizados a la hora de la visualización de este aviso, pudiendo surgir discordancias con los datos que surgen de la documentación respectiva. Las medidas y superficies exactas son las que surgen de los títulos y planos legales del inmueble. Las imágenes publicadas lo son al mero efecto orientativo de las características generales y circunstancias del inmueble en el momento en que han sido tomadas, pudiendo las mismas diferir del estado y circunstancias actuales del mismo. Asimismo, los mobiliarios, accesorios, elementos, etc, que se visualicen en las imagines publicadas, no integran la oferta de venta. En todos los casos el interesado deberá realizar una visita al inmueble y efectuar las verificaciones respectivas previamente a la realización de cualquier operación, requiriendo la documentación que corresponda. Venta supeditada al cumplimiento por parte del propietario de los requisitos de la resolución general Nº 2371 de la afip (pedido de coti). -",,,,WhatsApp,Contactar,Naon al 3500,38,1,1,,,
/propiedades/clasificado/veclapin-venta-departamento-a-estrenar-con-amenities-55061706.html,15,88000,USD,83000,$,"Saavedra, Capital Federal",36 m² tot.1 amb.1 dorm.1 baño,"Venta monoambiente A estrenar muy luminoso Ruiz Huidobro 4600Zona arbolada, de casas bajas. Entre Miller y LugonesExcelente ingreso de luz y balcón al frente Baño completoCocina eléctrica con horno Muebles bajo y sobre mesadasInteriores de placard con mueble para tv de diseño ya colocadoEquipo de split frio calorConección de lavarropas Luminarias ya colocadas en baño y estarEsta unidad se encuentra en un 7° piso al contrafrenteConsta de 36 mt2 totales. Amenities: Pileta, solárium y salón de usos múltiples. Escritura inmediataUbicación: El edificio está en una Zona en crecimiento, a tres cuadra de Parque Saavedra, zona de casa bajas, barrio tranquilo próximo a principales accesos como Av Gral Paz, Av Cabildo, Av Cramer. Cerca de supermercados, colegios y medios de locomoción. © 2024 Coldwell Banker. Todos los derechos reservados. Coldwell Banker y los logotipos de Coldwell Banker son marcas de servicio de propiedad de Coldwell Banker Real Estate llc. El sistema Coldwell Banker® está compuesto por oficinas propias de propiedad de una subsidiaria de Realogy Brokerage Group llc y por oficinas adheridas al Sistema Coldwell Banker que son de propiedad y operación independientes. En cumplimiento con la normativa vigente, los asistentes no ejercen el corretaje inmobiliario. La intermediación y conclusión de las operaciones inmobiliarias es desarrollada por Martilleros y Corredores Públicos. Esta oficina inmobiliaria se encuentra a cargo de Maria Lucila Ipuche, C. U. C. I. C. B. A. Número 6106, Libro 1, Folio 228, C. M. C. P. S. I. Número 5625, Tomo 9, Folio 20, adherida al sistema Coldwell Banker, C. U. I. T. Ver datos-8, Nicaragua 5651 Piso 6 caba cp 1414Nota: La información gráfica y escrita contenida en el presente aviso es meramente a titulo estimativo y no forma parte de ningún tipo de documentación contractual. Las medidas y superficies definitivas surgirán del título de propiedad del inmueble referido. Asimismo los importes de tasas, servicios y expensas indicados están sujetos a verificación. El valor del inmueble indicado en el presente puede ser modificado sin previo aviso. Operación supeditada a que el propietario cumplimente con la Reg. 2371 coti. Toda la información y medidas provistas son aproximadas y deberán ratificarse con la documentación pertinente y no compromete contractualmente a nuestraempresa.",,,,WhatsApp,Contactar,Ruiz Huidobro al 4600 7°,36,1,1,,,1
/propiedades/clasificado/veclapin-departamento-en-venta-saavedra-54831981.html,12,98000,USD,130000,$,"Saavedra, Capital Federal",42 m² tot.1 amb.1 baño,"Oportunidad de inversión! Apto credito! Excelente ubicación! Sobre calle Deheza al 3100, entre Pinto y Quintana. A dos cuadras de Av. Gral Paz. A siete cuadras de Av. Cabildo. A cinco cuadras de Av. San Isidro Labrador. El departamento se encuentra en el 2do. Piso contrafrente. Hermoso monoambiente divisible. Luminoso living comedor. Cocina con gas natural, integrada al living comedor. Amplio baño completo. Agua caliente central. Luminoso balcón, con espacio para lavarropas. Placard con interiores. Expensas $ 130. 000 (incluido Aysa) / abl $ 12. 000 Calefacción por tiro balanceado marca Longvie. Pre instalación para aa en lc. Superficie total: 42. 39 m2 / Superficie cubierta: 37. 30 m2 / Balcón: 5. 09 m2 Apto personas con movilidad reducida. - C. U. C. I. C. B. A. - Matricula Nº 597 -Nota importante: Toda la información y medidas provistas son aproximadas, deberán ratificarse con la documentación pertinente y no compromete contractualmente a nuestra empresa. Los gastos (expensas, abl) expresados refieren a la última información recabada y deberán confirmarse. Fotografías no vinculantes ni contractuales.",,,,WhatsApp,Contactar,Deheza al 3100,42,1,1,,,
/propiedades/clasificado/veclapin-lindisimo-depto-frente-a-estacion-de-coghlan-apto-55640232.html,23,91000,USD,169000,$,"Coghlan, Capital Federal",39 m² tot.1 amb.1 dorm.1 baño,"Apto creditoen muy buen edificio frente a la estación de tren, depto de 1 amb. Muy bien dividido (dormitorio de 3. 10 * 3. 00) y living comedor con cocina integrada, balcón con deck y espacio para lavarropas, baño completo. El edificio cuenta con terraza de uso común con parrilla, jacuzzi, solarium, sauna y gym y pequeño laundry en pb. Ubicación geográfica: esta ubicado entre Belgrano R y Villa Urquiza el barrio de Coghlan se destaca por su fuerte carácter residencial en una mixtura donde conviven edificios modernos de mediana densidad y numerosas casonas de estilo inglés en excelente estado de conservación, valiosa arboleda urbana, cuidadosjardines, etc, que le confieren características paisajísticas singulares. Muy vinculado al resto de la ciudad por 2 líneas de tren y a metros de distancia de sus estacionesCoghlan y J. M. Drago. Las expensas, abl y Aysa no son exactas y están sujetas a modificaciones&quot;Las medidas son aproximadas y orientativas. Las medidas exactas surgirían del título de propiedad&quot;Venta supeditada al cumplimiento por parte del propietario de los requisitos de la Resolución General 2371 de la afip. &quot;Las expensas, abl y Aysa no son exactas y están sujetas a modificaciones&quot;&quot;Las medidas son aproximadas y orientativas. Las medidas exactas surgirían del título de propiedad&quot;“Venta supeditada al cumplimiento por parte del propietario de los requisitos de la Resolución General 2371 de la afip. ”",,,,WhatsApp,Contactar,Estomba  al 2600,39,1,1,,,1
/propiedades/clasificado/veclapin-departamento-venta-monoambiente-saavedra-con-53350320.html,13,115000,USD,103880,$,"Saavedra, Capital Federal",32 m² tot.1 amb.1 baño1 coch.,"*Ver datos*hermoso monoambiente A la venta con renta. la unidad cuenta con amplio estar super luminoso con salida A balcon, cocina americana con horno Y anafes electricos, muebles bajo mesada, barra desayunadora, termotanque individual electrico, conexion P/lavarropas, baño completo, aire frio calor. amenities: pileta, gym, sum Y parrillacochera fija Y cubiertano dejes de visitarlo. Ver datos - 4787. 3489**Las medidas son a modo informativo y pueden sufrir variaciones siendo las definitivas las que surjan de la escritura o boleto**",,,,WhatsApp,Contactar,Arias al 2900,32,1,1,,1,
/propiedades/clasificado/veclapin-alquiler-saavedra-monoambiente-54841297.html,10,115000,USD,100000,$,"Saavedra, Capital Federal",42 m² tot.1 amb.1 baño,"Luminoso departamento monoambiente divisible. Sobre Avenida Ricardo Balbín al 3500, entre Washington y Nuñez. Excelente zona comercial y familiar. Tercer piso al frente. Orientación: Noroeste. Edificio eléctrico. Con sum, parrilla y laundry en el último piso. Antigüedad de 14 años. Agua caliente por termotanque central. Expensas actuales $100. 000 (Aysa incluida) Muy luminoso espacio con Aire Acondicionado frío- calor. Baño completo. Cocina integrada con horno y anafe doble eléctrico. Muebles en alto y bajo mesada. Superficie total: 42. 55 m2 / Superficie cubierta: 39. 43 m2 / Superficie descubierta: 2. 99 m2Medios de transporte cercanos: Ver datos. Estación Saavedra ffcc Mitre – Retiro. A tres cuadras de la zona comercial de Saavedra. - C. U. C. I. C. B. A. - Matricula Nº 597 -Nota importante: Toda la información y medidas provistas son aproximadas, deberán ratificarse con la documentación pertinente y no compromete contractualmente a nuestra empresa. Los gastos (expensas, abl) expresados refieren a la última información recabada y deberán confirmarse. Fotografías no vinculantes ni contractuales.",,,,WhatsApp,Contactar,Av Dr Ricardo Balbin 3500,42,1,1,,,
