price_value,bathrooms,expenses_value,CARD_CONTACT_MODAL,description,phone,parking,CARD_VIEWPHONE,price_type,square_meters_area,url,rooms,location,POSTING_CARD_FEATURES,expenses_type,bedrooms,CARD_WHATSAPP,POSTING_CARD_GALLERY,CARD_FAV,address
96000,1,60000,Contactar,"* gran oportunidad Depto 2 amb! * al frente con balcon corrido. * Originalmente Unidad de 3 amb (66 M2) * Gran living comedor, Pisos de Madera. * Puerta Balcon c/Salida al Mismo + Ventana. * Posibilidad de restaurar a 2 Habitaciones! * dormitorio en suitte al Fte c/Placard. * toilette de recepcion. * cocina indep. Muy bien equipada. * comedor diario. * ubicacion de privilegio; Av Rivadavia. * 20 Lineas de Colectivos, subte ""A"" * Centro Comercial, Salas de Cine, Shopping Caballito. * Proximo Av Acoyte, Parque Rivadavia, Colegios, Polo Gastronomico",,,,USD,66,/propiedades/clasificado/veclapin-av-rivadavia-5500-venta-departamento-de-dos-ambientes-54807938.html,2,"Caballito, Capital Federal",66 m² tot.2 amb.1 dorm.1 baño,$,1,WhatsApp,22,,AV. RIVADAVIA 5400
80000,1,,Contactar,"J. Fortugno propiedades vende. Duplex de dos ambientes. Compuesto: En planta baja, cocina comedor y living integrado (posibilidad debajo de escalera de armado de toilette, cuenta con la instalacion preparada) En planta alta, 1 dormitorio con placard, baño completo y patio cubierto con acceso a la terraza. Muy buen estado, no se abonan expensas. Consulte para coordinar visita Aviso publicado por Pixel Inmobiliario (Servicio de Páginas Web para Inmobiliarias). #1116",,,,USD,70,/propiedades/clasificado/veclapin-venta-duplex-2-ambientes-villa-lugano-52642066.html,2,"Villa Lugano, Capital Federal",70 m² tot.2 amb.1 dorm.1 baño,,1,WhatsApp,14,,"Lisandro de la torre 5100, Villa Lugano, Capital Federal, Argentina."
88900,1,,Contactar,"Precio total usd$ 127. 000. oportunidad de financiacion: 70% inicial (usd$ 88. 900) + 30% financiado en 24 cuotas. ¡Oportunidad única en Caballito! Este hermoso departamento de 2 ambientes a estrenar es ideal para quienes buscan comodidad, luminosidad y excelente ubicación. Con un moderno diseño, cuenta con un amplio y luminoso living, toilette de recepción, y un dormitorio en suite con vestidor y baño privado, brindando total privacidad y confort. El edificio es de última generación, lo que garantiza acabados de calidad. Su cercanía al Parque Centenario, Plaza 24 de Septiembre, a zonas comerciales y al vibrante polo gastronómico de la zona, lo convierten en un lugar perfecto para vivir. ¡No te lo podés perder! Transportes cercanos: Colectivos: 24, 34, 57, 76, 105, 109, 110, 135, 146, 166. aviso legal: La presente publicación describe las características esenciales de la propiedad, cuyos valores y medidas son aproximados. Para más informacióncomo actualización de losvalores de expensas, servicios, impuestos, precios, información o descripción arquitectónica, debe consultar al corredor público inmobiliario responsable de la operación. Conforme a la Ley 2340 cucicba, Ley 10. 973 Prov. Bs. As. , Ley 22. 802 de Lealtad Comercial, Ley 24. 240 de Defensa al Consumidor, las normas del Código Civil y Comercial de la Nación y las disposiciones constitucionales, los Asesores o Brokers no ejercen el corretaje inmobiliario. En cumplimiento de las normas legales aplicables, todas las operaciones inmobiliarias son objeto de intermediación y conclusión por partedel corredor matriculado y colegiadoEduardo Casasnovas C. U. C. I. C. B. A. Mat Nº 6952, C. M. C. P. S. I. Mat Nº 5870. Cada Oficina es de Propiedad y OperaciónIndependiente. En caso de venta, la operación está sujeta a la tramitación del Código de Oferta de Transferencia de Inmuebles (coti) por parte del",,1,,USD,68,/propiedades/clasificado/veclapin-departamento-2-ambientes.-av-san-martin-al-1700-55313653.html,2,"Caballito, Capital Federal",68 m² tot.2 amb.1 dorm.1 baño1 coch.,,1,,27,,AV SAN MARTIN 1700. Entre Tres arroyos y Galicia
79000,1,60000,Contactar,"Corredor Responsable: Mariano Aufseher cpi 4251 / Francisco Aufseher cmzc 600- Contacto: Gerardo Boni. Departamento 2 ambientes venta - balvanera. Venta departamento 2 ambientes, superficie total de 65. 1 mt2, ubicado a 1/2 cuadra de la estación Pasteur del subte línea B en la avenida Corrientes. A solo cuatro cuadras del hospital de Clínicas, la Facultad de Medicina, la Facultad de Ciencias Económicas y a cinco de la Facultad de Odontología, como también en la zona comercial de Once y a 15 cuadras del obelisco. Es en el 4to piso al frente, al ingresar nos encontramos con una antesala de distribucion, a su derecha la cocina, con acceso a una terraza interna con lavadero. El baño con bañadera. Habitacion con placard y ventana orientada al pulmon del edificio. Amplio living con balcón a la calle Pasteur, muy luminoso. Los metros aqui publicados son aproximados. Los reales surgen de la escritura. \""En cumplimiento de las leyes provinciales vigentes que regulan el corretaje inmobiliario, Ley Nacional 25. 028, Ley 22. 802 de Lealtad Comercial, Ley 24. 240 de Defensa al Consumidor, las normas del Código Civil y Comercial de la Nación y Constitucionales, los agentes no ejercen el corretaje inmobiliario. Todas las operaciones inmobiliarias son objeto de intermediación y conclusión por parte de los martilleros y corredores colegiados, cuyos datos se exhiben debajo del nombre de la inmobiliaria. \"" Remax Argentina S. R. L. No ejerce el corretaje inmobiliario. El presente sitio web es una plataforma en donde cada oficina inmobiliaria independiente que contrata los servicios re/max puede publicar las propiedades a su cargo. Cada oficina es de propiedad y gestión independiente, por lo que Remax Argentina S. R. L no interviene en los datos de la publicación, en la operación inmobiliaria, ni en la confección y/o firma del boleto de compraventa y/o escritura y/o contrato de alquiler. En cumplimiento de las leyes vigentes que regulan el corretaje inmobiliario, Ley Nacional 25. 028, Ley 22. 802 de Lealtad Comercial, Ley 24. 240 de Defensa al Consumidor, las normas del Código Civil y Comercial de la Nación y Constitucionales, los agentes/gestores no ejercen el corretaje inmobiliario. Todas las operaciones inmobiliarias son objeto de intermediación y conclusión por parte del corredor público inmobiliario colegiado a cargo de la publicación, cuyos datos se exhiben en la presente. La presente publicación describe las características esenciales del inmueble, debiéndose consultar al corredor público inmobiliario responsable de la operación por la eventual actualización de las medidas, descripciones arquitectónicas y funcionales, valores de expensas, servicios, impuestos, precios y demás información, cuyos valores son aproximados. El inmueble no es accesible para personas con discapacidades físicas. Comprá la casa que querés! No la que podés. Accedé a un préstamo por hasta el 30% del valor de esta propiedad. Simulá tu cuota en Lendar",,,,USD,65,/propiedades/clasificado/veclapin-departamento-2-ambientes-venta-balvanera-55411328.html,2,"Once, Capital Federal",65 m² tot.2 amb.1 dorm.1 baño,$,1,,21,,Pasteur 400
110000,1,100000,Contactar,"Venta de Departamento 2 ambientes con baulera en San Nicolás, Capital Federal. departamento 2 amb en pb con Baulera. Múltiples fines. Vivienda, Oficina o Depósito. Living comedor Integrado con otro ambiente. Toilette. Cocina Separada. Patio. Domitorio ;Baño. Descubre los múltiples usos de un departamento en el corazón de Buenos Aires, cerca del icónico Obelisco y la Av. Corrientes. Este departamento puede ser un hogar acogedor, ideal para disfrutar de la vida urbana y todas las comodidades que ofrece la ciudad. Otra opción es utilizarlo como oficina. Su céntrica ubicación permite fácil acceso y comodidad para trabajar. Con 66 metros cuadrados, este espacio es versátil y puede adaptarse a tus necesidades personales o laborales. Además, cuenta con una baulera, perfecta para guardar tus cosas y mantener el lugar ordenado. Transportes Cercanos. Colectivos: 5, 6, 7, 8, 9, 10, 12, 17, 23, 24, 26, 29, 37, 39, 45, 50, 56, 59, 60, 64, 67, 70, 86, 90, 91, 98, 100, 102, 103, 105, 109, 111, 115, 124, 129, 140, 146, 150, 151, 180. Subtes (Metro): saenz peña (Línea A), tribunales (Línea D), uruguay (Línea bte esperamos! Las medidas, superficies y expensas consignadas en la presente son aproximadas; y al solo efecto orientativo. Los datos definitivos son los que surgirán del título de la propiedad y de los comprobantes respaldatorios. ” La presente oferta está condicionada a la confección del coti (res afip 2371). La intermediación y la conclusión de las operaciones de todas las propiedades que figuran en este perfil se encuentran a cargo de gisi lm S. A. Se realizan con la intervención de Vanesa Amanda García cucicba 8237/ cpmcal 562. En cumplimiento de las leyes provinciales vigentes que regulan el corretaje inmobiliario, Ley Nacional 25. 028, Ley 22. 802 de Lealtad Comercial, Ley 24. 240 de Defensa al Consumidor, las normas del Código Civil y Comercial de la Nación y Constitucionales, los agentes/gestores/asesores no ejercen el corretaje inmobiliario. En cumplimiento de lo dispuesto por la ley 5115, se informa que, el presente inmueble posee acceso para personas con discapacidad físicas.",,,,USD,66,/propiedades/clasificado/veclapin-venta-de-departamento-2-ambientes-con-baulera-en-san-55458157.html,2,"San Nicolás, Capital Federal",66 m² tot.2 amb.1 dorm.1 baño,$,1,WhatsApp,19,,SARMIENTO 1426
90000,1,35000,Contactar,"Venta departamentos semipisos de 2 ambientes al contrafrente con balcón A estrenar, edificio de 6 pisos en el 7º se encuentra la terraza de uso común, esta ubicada en la zona de mataderos entre juan bautista alberdi Y emilio castro, living comedor cocina integrada piso porcelanato con muebles altos Y bajos de primera linea mesada de mármol amplia, espacio para lavarropa, termotanque eléctrico anafe de 4 hornallas A gas, dormitorios con placard sus piso son de madera tipo parquet, baño completo vanitory con receptor de ducha, hay 5 cocheras en pb. Optativas. ! Excelente construccion! Constructor de renombre en la zona! Listo para escriturar! Quedan solo dos en el edifico en el 2º Y 6º piso, el resto todos vendidos Y ocupados!! Vende. deocare propiedades. mp 6940. Ver datos",,,,USD,70,/propiedades/clasificado/veclapin-retazado!-departamento-de-2-ambientes-al-frente-con-45096491.html,2,"Mataderos, Capital Federal",70 m² tot.2 amb.1 dorm.1 baño,$,1,WhatsApp,17,,ARAUJO 940
105000,1,,Contactar,"Ph de dos ambientes primer piso por escalera, en buen estado, living comedor, dormitorio con placard, cocina tipo comedor, baño completo, terraza. Las superficies y medidas son aproximadas y a solo efecto orientativo.",,,,USD,100,/propiedades/clasificado/veclapin-ph-en-planta-alta-55472712.html,2,"Saavedra, Capital Federal",100 m² tot.2 amb.1 dorm.1 baño,,1,WhatsApp,9,,Vilela  3800
69000,1,140000,Contactar,"Corredor Responsable: Claudio Rudecindo cmcpsi 6807 / Cristian Arnal Ponti cpi 3570- Contacto: Ana Gonzalez Crende. Departamento luminoso a 2 cuadras de Carlos Pellegrini y del Metrobus de Av. 9 de julio. El edificio es antiguo y de excelente calidad con paredes de mármol en la entrada. Se encuentra en el contrafrente del 2° cuerpo con ventana a amplio aire y luz lo que hace que sea muy luminoso. Tiene 1 dormitorio de gran tamaño con placares que ocupan toda una pared y un comedor diario. Baño completo con bañadera y ducha y 1 toilette. Cocina luminosa que desemboca en un pequeño lavadero. El agua caliente es por calefón a gas. 11 líneas de colectivos: 9, 10, 17, 45, 59, 67, 70, 91, 98, 100 y 129. Lineas B y D de subte. Se vende con renta hasta fin de contrato el 31/01/2025. Renta actual $200. 000. apto credito. Se denomina informalmente Microcentro a una zona de la Ciudad de Buenos Aires caracterizada por la concentración de edificios administrativos y de oficinas, coincidente grosso modo con el área alrededor del centro histórico de la Plaza de Mayo. El Microcentro no forma parte de los 48 barrios porteños reconocidos oficialmente y por lo tanto no tiene límites establecidos; su ubicación se superpone aproximadamente con el barrio de San Nicolás y parte de los de Monserrat y Retiro. La zona del Microcentro al norte de Plaza de Mayo, característico centro financiero de la Argentina donde se ubican las casas matrices de los principales bancos y la Bolsa de Comercio, es apodada tradicionalmente \""La City Porteña\"". Remax Argentina S. R. L. No ejerce el corretaje inmobiliario. El presente sitio web es una plataforma en donde cada oficina inmobiliaria independiente que contrata los servicios re/max puede publicar las propiedades a su cargo. Cada oficina es de propiedad y gestión independiente, por lo que Remax Argentina S. R. L no interviene en los datos de la publicación, en la operación inmobiliaria, ni en la confección y/o firma del boleto de compraventa y/o escritura y/o contrato de alquiler. En cumplimiento de las leyes vigentes que regulan el corretaje inmobiliario, Ley Nacional 25. 028, Ley 22. 802 de Lealtad Comercial, Ley 24. 240 de Defensa al Consumidor, las normas del Código Civil y Comercial de la Nación y Constitucionales, los agentes/gestores no ejercen el corretaje inmobiliario. Todas las operaciones inmobiliarias son objeto de intermediación y conclusión por parte del corredor público inmobiliario colegiado a cargo de la publicación, cuyos datos se exhiben en la presente. La presente publicación describe las características esenciales del inmueble, debiéndose consultar al corredor público inmobiliario responsable de la operación por la eventual actualización de las medidas, descripciones arquitectónicas y funcionales, valores de expensas, servicios, impuestos, precios y demás información, cuyos valores son aproximados. El inmueble no es accesible para personas con discapacidades físicas. Comprá la casa que querés! No la que podés. Accedé a un préstamo por hasta el 30% del valor de esta propiedad. Simulá tu cuota en Lendar",,,,USD,61,/propiedades/clasificado/veclapin-venta-antiguo-2-ambientes-en-san-nicolas-55633378.html,2,"Centro / Microcentro, Capital Federal",61 m² tot.2 amb.1 dorm.1 baño,$,1,,27,,Tucumán 700
88000,1,8800,Contactar,Departamento alquilado se transfiere la titularidad con renta. hall 3. 00 mts X 3. 00 mts. living 4. 00 mts X 4. 00 mts. pasillo de distribución 1. 50 mst X 0. 80 mts. baño 2. 00 mts X 2. 00 mts. dormitorio 4. 00 mts X 4. 00 mts. cocina 4. 00 mts X 3. 00 mts. patio 3. 00 mts X 3. 50 mts. lavadero 2. 00 mts X 1. 00 mts. U$S 113. 000 Ó U$S 70. 000 Y cuotas A convenir. se deja constancia que las medidas. Superficies Y M2 consignados son aproximados. Sujetos A verificación Y/O ajuste. El precio del inmueble puede ser modificado sin previo aviso. Fotos de carácter no contractual. Resolución afip. Venta supeditada al cumplimiento por parte del propietario de los requisitos de la Res. Gral. 2371 de la afip.,,,,USD,70,/propiedades/clasificado/veclapin-2-amb-al-frente-pb-con-patio-dean-funes-a-m-de-av-43959999.html,2,"Balvanera, Capital Federal",70 m² tot.2 amb.1 dorm.1 baño,$,1,WhatsApp,10,,DEAN FUNES 400
120000,3,,Contactar,"Inmueble atípico, muy cerca de la estación Congreso de Tucumán subte ""D"" 110 m2 cubiertos; cocina integrada, tres baños. Tres cocheras cubiertas fijas",,3,,USD,110,/propiedades/clasificado/veclapin-vivienda-2coch-local-oficina-54196719.html,2,"Núñez, Capital Federal",110 m² tot.2 amb.1 dorm.3 baños3 coch.,,1,WhatsApp,11,,Guayra
41875,2,,Contactar,"¡tu oportunidad de ser dueño! Anticipo - emprendimiento. bartolomé mitre 3818 / almagro. unidades 2 ambientes. precio total de unidad ""I"": desde usd 167. 500. - saldo restante en 48 cuotas sin interés. Doble emprendimiento: B. Mitre 3818 / J. Salguero 82. luminosos, hechos con materiales de excelente calidad Y buen gusto. Living comedor con balcón espacioso. Habitación en suite con vestidor. cocina integrada con la mejor mueblería, pileta inoxidable, cocina 4 hornallas. Instalación para lavarropas. Baño completo con artefactos de 1° marca. Conexión para aire acondicionado. Edificio de ultima generación. Unidades emplazadas en 9 plantas. Full amenities: jacuzzi externo, solarium, gimnasio, parrilla, sum, laundry, espacio co-working. cocheras disponibles Y espacio exclusivo para cada unidad en bicicletero. Excelente ubicación - cercano A av. Rivadavia Y av. Diaz velez. Colectivos: 5, 8, 19, 26, 86, 88, 90, 103, 104, 105, 127, 128, 132, 146, 151, 160, 164, 180. Subtes (Metro): castro barros (Línea A), loria (Línea A) para mas información, comunicate con nosotros Y agendá tu reunión. Nota importante: Toda la información y medidas provistas son aproximadas, deberán ratificarse con la documentación pertinente y no compromete contractualmente a nuestra empresa. Los gastos (expensas, abl) expresados refieren a la última información recabada y deberán confirmarse. Fotografías no vinculantes ni contractuales. Ley 5115: excepto que en la descripción de la propiedad se indique lo contrario, el edificio puede no contar con rampa para personas con movilidad reducida, y no ser Accesible para personas con discapacidades físicas. - torrisi propiedades. José Tortorelli. Mat. C. U. C. I. C. B. A nro. 24. Servicios: Electricidad, Agua Corriente. Otros Servicios: Balcón",,,,USD,67,/propiedades/clasificado/veclapin-anticipo-emprendimiento-2amb-full-amenities-b.-54669993.html,2,"Almagro, Capital Federal",67 m² tot.2 amb.1 dorm.2 baños,,1,WhatsApp,10,,Bartolomé Mitre  3800
120000,1,68000,Contactar,"Departamento con dos dormitoriosconcon pisos de pinotea. Muy luminoso. Amplia cocina Y living comedorcon con pisos de robles. . baño principal completo Y toilette. Disposicion lateral con orientacion oeste. el departamento fue refaccionado con cambio de pisos Y pintura Y mantenimiento en general. coordinar para visitar. Coti en tramite. *Se deja constancia que las medidas (tanto totales como parciales), superficies, m2 y proporciones indicadas en el presente son aproximadas y sujetas a verificación, variación y/o ajuste. El precio de la presente operación y/o de las expensas aquí indicadas están sujetos a modificación sin previo aviso",,,,USD,67,/propiedades/clasificado/veclapin-venta-tres-ambientes-d-peron-1.757-54862880.html,2,"Balvanera, Capital Federal",67 m² tot.2 amb.2 dorm.1 baño,$,2,WhatsApp,9,,PRESIDENTE PERON 1700
120000,1,,Contactar,"""""espectacular emprendimiento"""" Edificio de Categoria. Amplio Living Comedor con Cocina Integrada. Altos y Bajo Mesada Completa. Aberturas Doble Vidrio. Aire Acondicionado. Baño Completo. Balcon Corrido. Habitaciones con placard.",,,,USD,97,/propiedades/clasificado/veclapin-villa-luro.-corvalan-200.-semipiso-2-ambientes-con-52553730.html,2,"Villa Luro, Capital Federal",97 m² tot.2 amb.1 dorm.1 baño,,1,WhatsApp,5,,CORVALAN
98000,1,90000,Contactar,"2 departamentos en Venta: Dpto. 1: 39. 60m2. (Aprox. ). * 2 Ambientes. * Dormitorio. * Entrepiso. (10m2 aprox. ). * Cocina independiente (con alacenas bajo mesada). * Baño completo. * Patio descubierto. Dpto. 2: 43m2. (Aprox. ). * 2 Ambientes. * Entrepiso. (12m2 aprox. ). * Baño completo. * Patio descubierto. * Subsuelo. Apto Profesional - Apto Crédito. Se trata de so departamentos tipo ph en buenas condiciones, ambos ubicados en planta baja, con disposición al frente, se accede por entrada independiente. Cada unidad dispone de puerta vidriada con salida al patio siendo muy luminoso y ventilado. Edificio señorial de estilo francés y declarado patrimonio historio por aph. Se compone de cinco plantas y dispone de sum, lavadero, deck y pileta con parrilla de uso común. Bajas expensas. Excelente ubicación en el barrio de Balvanera a 200m. De Av. Independencia, 100m. De Av. Belgrano, 300m. De Av. Jujuy y 600m. De Av. Entre Ríos con gran variedad en líneas de colectivo, lineamiento comercial y servicios. Plaza Velasco Ibarra a 200m. Estación de Subte Línea H a 300m. Constructora desarrollostel. Ver datos Ver datosAv. Eva Perón 5699 - Mataderoswww. arfaconstruyendo. com. ar",,,,USD,100,/propiedades/clasificado/veclapin-oportunidad-departamentos-al-frente-en-balvanera-55406225.html,2,"Balvanera, Capital Federal",100 m² tot.2 amb.1 dorm.1 baño,$,1,,23,,Matheu 600
95000,1,,Contactar,"El emprendimiento se desarrolla en 12 pisos, ubicado en el barrio de San Cristóbal, a una cuadra de la estación Humberto Primo del subte H y E, se destaca por su cómoda accesibilidad. El edificio cuenta con unidades de 1 y 2 ambientes que van desde los 28m2 a 68m2. En la planta baja hay espacio para un local comercial. Consulte por unidades disponibles en distintos metrajes y tipologías. En cuanto a sustentabilidad y tecnología, el desarrollo cuenta con: - Recolección de agua de lluvia- Un bicicletero por cada unidad funcional- Carpinterías con dvh- Sistema de agua caliente central- Iluminación de áreas comunes bajo consumo- Uso de productos sustentablescómo participar del desarrollo- Modalidad de Fideicomiso al costo- Aporte inicial del 50% para la adquisición del terreno- 20 cuotas iguales y consecutivas a partir del inicio de la obra- Consultar por otra forma de pagofecha estimada de entrega: Principios 2024cucicba 5783/ cmcpzc 482 Toda la información, medidas provistas son aproximadas, deberán ratificarse con la documentación pertinente y no compromete contractualmente a nuestra empresa. Los gastos (Expensas, abl, etc) expresados, refieren a la última información recabada y deberán confirmarse al día de la fecha. Las fotografías son no vinculantes ni contractuales.",,,,USD,68,/propiedades/clasificado/veclapin-departamento-san-cristobal-52434436.html,2,"San Cristobal, Capital Federal",68 m² tot.2 amb.1 dorm.1 baño,,1,,3,,"Humberto Primo 2785, Fideicomiso Al Costo en San Cristóbal - Departamento Dos Ambientes"
67000,1,,Contactar,"Hermoso Departamento en venta de 2 ambientes ubicado en la planta baja, en La Paternal. Excelente ubicación a metros de Av. San Martin. Cercano a Zona comercial y gastronómica. Multiples opciones de transporte. Se trata de una unidad de 2 amplios ambientes, ubicado en la planta baja con patio y lavadero. Al ingresar nos encontramos con un recibidor distribuidor, que nos conduce a la cocina, habitación y living-comedor diario. La cocina se encuentra a la derecha y posee muebles en alto y bajo mesada, al final de ella tenemos el lavadero separado. Living comedor, Dormitorio de grandes dimensiones. , Y Baño completo con bañera. . La intermediación y la conclusión de las operaciones son llevadas a cabo por el profesional matriculado Juan Manuel Manfe C. U. C. I. C. B. A. 7972 / C. M. C. P. M. 2938. Cada Oficina es de Propiedad y Operación Independiente.",,,,USD,64,/propiedades/clasificado/veclapin-hermoso-departamento-en-venta-de-2-ambientes-ubicado-55548533.html,2,"La Paternal, Capital Federal",64 m² tot.2 amb.1 dorm.1 baño,,1,,18,,Fragata Sarmiento 2054 0
120000,3,262000,Contactar,"Venta de Departamento en Nuñez, Capital Federal. vivienda + local/ oficina / deposito + 3 cocheras. Monoambiente con ampliodepósito y 3 cocheras fijas cubiertas, apto profesional / varios destinos. Posee entrada independiente. Se puede ingresar tanto por el frente como por el sector de cocheras en subsuelo. Está distribuido en dos niveles, al frente en pb monoambiente de 28 de m2 con cocina integrada y toilette. En subsuelo amplio depósito de 78 m2, distribuido en varios ambientes y 2 baños. 167 m2 total con las 3 cocheras cubiertas. Expensas Noviembre 2024 $ 262. 000. Excelente ubicación, próximo a Estación Núñez, a Estación Congreso de Tucumán del Subte D, 2 cuadras de Av. Cabildo y 6 cuadras de Av. Del Libertador. Oportunidad! xintel(pas-pas-3342)",,3,,USD,167,/propiedades/clasificado/veclapin-departamento-en-venta-de-2-amb-en-nunez-55074261.html,2,"Núñez, Capital Federal",167 m² tot.2 amb.1 dorm.3 baños3 coch.,$,1,WhatsApp,17,,GUAYRA 2182. Entre Cuba y Arcos
75000,1,90000,Contactar,"- Av. Rivadavia al 2800- piso 11 al frente, con balcón corrido. - Superficie total: 67 mts, 47 cubiertos. - Inmejorable vista a Plaza Meserere. Muy luminoso. - Living comedor, 1 dormitorio, ambos con salida al balcón completo. - Posibilidad de armar un segundo dormitorio, dividiendo el Living Comedor. - Cocina separada con lavadero, baño completo. - Dos ascensores. Colectivos: 2, 5, 7, 8, 19, 24, 31, 32, 41, 56, 57, 61, 62, 64, 68, 71, 75, 86, 88, 90, 98, 101, 103, 104, 105, 115, 118, 124, 129, 132, 146, 151, 164, 168, 180, 188, 194. Subtes (Metro): plaza de miserere (Línea A), plaza once (Línea H) Trenes: Estación Once (sarmiento). Las medidas son meramente descriptivas y esquemáticas. Las fotos del presente inmueble son facilitadas al sólo efecto de otorgar una rápida visualización del inmueble. Las medidas exactas surgirán de la escritura y/o planos del inmueble. El valor de las expensas mensual está sujeto a verificación y/o ajuste. Cumpliendo con la Ley 5115, el inmueble no es accesible para personas con discapacidad física. La Venta de este Inmueble está Sujeta a la Tramitación del Código de Transferencia de Inmuebles (coti), de Conformidad con la Normativa Vigente (Res. Afip por parte del propietario) cucicba 6983 / cpmcal 467.",,,,USD,67,/propiedades/clasificado/veclapin-venta-departamento-2-3-ambientes-once-balvanera.-48089345.html,2,"Once, Capital Federal",67 m² tot.2 amb.1 dorm.1 baño,$,1,WhatsApp,22,,AV. RIVADAVIA 2800
