price_value,bathrooms,expenses_value,CARD_CONTACT_MODAL,description,phone,parking,CARD_VIEWPHONE,price_type,square_meters_area,url,rooms,location,POSTING_CARD_FEATURES,expenses_type,bedrooms,CARD_WHATSAPP,POSTING_CARD_GALLERY,CARD_FAV,address
99000,1,,Contactar,"Corredor Responsable: Mauro Marvisi cmcpsi 5574 / cucicba 1762- Contacto: Michael Miller. Venta. Dos ambientes impecables piso alto con inmejorable vista abierta. Se accede a esta propiedad por un gran palier con dos ascensores. Al ingresar a esta propiedad nos encontramos una habitación principal de muy buenas medidas con un ventanal de pared a pared que permite el ingreso de la luz natural durante todo el día este es un espacio ganado a un balcón lo que da una extensión de ese ambiente y un marco muy especial a la abertura. Los pisos son de madera en excelente estado, aire acondicionado y amplio placard con cajoneras y lugar de guardado, cómodos y bien mantenidos. La gran vista permite apreciar la ciudad desde lo alto de esta cómoda propiedad. Posee un living comedor muy amplio con ventana al exterior asegurando aire y luz en todo el inmueble. Pisos de madera en toda la unidad. Baño completo, muy cuidado. Totalmente reciclado con bañera grande y ventilación por ventana. En el pasillo distribuidor se ubica un placard de recepción o para artículos de blanco. Cocina separada del living/comedor por una puerta corrediza totalmente reciclada con mueble de bajo mesada y alacena nuevos y modernos, ventilación y pequeño lavadero. Con lugar para lavarropas y toilette de servicio. Agua caliente por calefón. Medidas aproximadas de los ambientes, comedor 3. 65 m2 ancho, y4. 40m2 de largo. Dormitorio 3. 75m2 ancho y 5. 45m2 largo. Muy cómodo y espacioso, además de luminoso y silencioso. Oportunidad. Esta propiedad se encuentra en una zona de excelente conectividad de transporte, vías de acceso a la ciudad y universidades. Excelente inversión. Transportes Cercanos. Colectivos: 2, 5, 6, 7, 8, 12, 23, 37, 39, 50, 56, 60, 64, 84, 86, 90, 98, 102, 103, 105, 150, 151, 168. Subtes (Metro): saenz peña (Línea A) Agenda una visita! Remax Argentina S. R. L. No ejerce el corretaje inmobiliario. El presente sitio web es una plataforma en donde cada oficina inmobiliaria independiente que contrata los servicios re/max puede publicar las propiedades a su cargo. Cada oficina es de propiedad y gestión independiente, por lo que Remax Argentina S. R. L no interviene en los datos de la publicación, en la operación inmobiliaria, ni en la confección y/o firma del boleto de compraventa y/o escritura y/o contrato de alquiler. En cumplimiento de las leyes vigentes que regulan el corretaje inmobiliario, Ley Nacional 25. 028, Ley 22. 802 de Lealtad Comercial, Ley 24. 240 de Defensa al Consumidor, las normas del Código Civil y Comercial de la Nación y Constitucionales, los agentes/gestores no ejercen el corretaje inmobiliario. Todas las operaciones inmobiliarias son objeto de intermediación y conclusión por parte del corredor público inmobiliario colegiado a cargo de la publicación, cuyos datos se exhiben en la presente. La presente publicación describe las características esenciales del inmueble, debiéndose consultar al corredor público inmobiliario responsable de la operación por la eventual actualización de las medidas, descripciones arquitectónicas y funcionales, valores de expensas, servicios, impuestos, precios y demás información, cuyos valores son aproximados. El inmueble no es accesible para personas con discapacidades físicas. Comprá la casa que querés! No la que podés. Accedé a un préstamo por hasta el 30% del valor de esta propiedad. Simulá tu cuota en Lendar",,,,USD,60,/propiedades/clasificado/veclapin-venta-amplio-dos-ambientes-impecable-vista-abierta-55616062.html,2,"Monserrat, Capital Federal",60 m² tot.2 amb.1 dorm.1 baño,,1,WhatsApp,9,,Avenida Belgrano 1600
91000,1,62000,Contactar,"Corredor Responsable: Silvana Inés Palini cmcpm 2955 cpi 8862- Contacto: Francisco Bruny. Venta de Departamento 2 Ambientes A refaccionar (semi piso) -superficie total: 66, 74m² Ubicado en una excelente zona de fácil acceso, el edificio es todo eléctrico: el departamento no cuenta con gas, lo que asegura un ambiente más seguro y una mayor eficiencia energética. Este departamento es ideal porque nos ofrece comodidad y diseño en cada rincón. Consta de: 1 habitación con baño en suite. 2 baños (uno en suite para mayor privacidad y comodidad). Cocina amoblada con espacio y funcionalidad. Comedor con un diseño moderno, que está dividido por barrales de madera, aportando un toque elegante. Living amplio con ventanales grandes que permiten la entrada de luz natural, brindando luminosidad al espacio durante todo el día. Balcon amplio. Este departamento es ideal para quienes buscan un hogar moderno, luminoso y bien distribuido, con una ubicación estrategica está bien conectada con el resto de la ciudad gracias a la cercanía de importantes avenidas y líneas de transporte público, como el subte y diversas líneas de colectivo. Algunos puntos de interés cercanos son: Parque Rivadavia: A pocos minutos caminando. Avenida Juan B. Justo: Muy cerca de esta dirección, es una de las avenidas principales que conecta el barrio con otras áreas como Villa del Parque, Villa Devoto y otros puntos importantes hacia el oeste. Estación de Subte \""Avenida Rivadavia\"" (Línea A): Esta estación se encuentra a corta distancia. La Línea A es la primera línea de subte de Buenos Aires y conecta la zona con el centro de la ciudad. Centro Comercial de Caballito: La zona está llena de tiendas, restaurantes y supermercados. ¡No dudes en agendar una visita para conocerlo! Remax Argentina S. R. L. No ejerce el corretaje inmobiliario. El presente sitio web es una plataforma en donde cada oficina inmobiliaria independiente que contrata los servicios re/max puede publicar las propiedades a su cargo. Cada oficina es de propiedad y gestión independiente, por lo que Remax Argentina S. R. L no interviene en los datos de la publicación, en la operación inmobiliaria, ni en la confección y/o firma del boleto de compraventa y/o escritura y/o contrato de alquiler. En cumplimiento de las leyes vigentes que regulan el corretaje inmobiliario, Ley Nacional 25. 028, Ley 22. 802 de Lealtad Comercial, Ley 24. 240 de Defensa al Consumidor, las normas del Código Civil y Comercial de la Nación y Constitucionales, los agentes/gestores no ejercen el corretaje inmobiliario. Todas las operaciones inmobiliarias son objeto de intermediación y conclusión por parte del corredor público inmobiliario colegiado a cargo de la publicación, cuyos datos se exhiben en la presente. La presente publicación describe las características esenciales del inmueble, debiéndose consultar al corredor público inmobiliario responsable de la operación por la eventual actualización de las medidas, descripciones arquitectónicas y funcionales, valores de expensas, servicios, impuestos, precios y demás información, cuyos valores son aproximados. El inmueble no es accesible para personas con discapacidades físicas. Comprá la casa que querés! No la que podés. Accedé a un préstamo por hasta el 30% del valor de esta propiedad. Simulá tu cuota en Lendar",,,,USD,67,/propiedades/clasificado/veclapin-venta-departamento-2-ambient-refaccionar-caballit-55550718.html,2,"Caballito, Capital Federal",67 m² tot.2 amb.1 dorm.1 baño,$,1,WhatsApp,31,,Avenida Rivadavia 5500
115000,1,,Contactar,"En el corazón de Monte Castro, Víctor Hugo esquina Av. Jonte a 900 metros de la Plaza Terám, y a 300 mts. De Av. Lope de Vega. Triplex en un primer piso por escalera al frente de 2 ambientes con balcón + terraza propia y Lavadero independiente. Al ingreso, en la primera planta, un baño de recepción, y un living comedor. A continuación, la Cocina Comedor integrada al ambiente y con salida al balcón corrido al frente. En la segunda planta, el dormitorio con vestidor y baño completo, en Suit. En la tercera planta, el Lavadero, completo con pileta de lavado y conexión para lavarropas, y salida a la Terraza Propia- Pisos porcelanato- aa en el living y la habitación - Aire y Sol natural todo el día Monte Castro es uno de los barrios en los que se encuentra dividida la Ciudad Autónoma de Buenos Aires. Comuna 10. Debe su nombre a Don Pedro Fernández de Castro, que se constituyó propietario de las tierras en 1703. Luego se lo comenzó a conocer como Chacra de Castro o Montes de Castro. Cerca de La Pizzería El Fortín en la esquina de Avenida Álvarez Jonte y Avenida Lope de Vega justo en el límite con el barrio de Villa Luro. ¡el futuro es hoy! ¡Si necesitas vender o comprar, ni lo dudes, puedo ayudarte! @Daniela_Sesto tasamos su propiedad en el diasomos profesionales altamente especializados en tasaciones para obtener el valor real de las propiedades utilizando los criterios más adecuados, respetando y cuidando el patrimonio del cliente que confía en nuestros servicios. aviso legallas medidas son aproximadas, las reales surgen del titulo de propiedad o plano de mensura. Las imágenes son a mero título ilustrativo. Las descripciones y valores de expensas, impuestos y servicios son aproximados y fueron proporcionados por el propietario y pueden no estar actualizados a la hora de la visualización de este aviso. Los precios indicados podrán modificarse sin previo aviso. Venta supeditada al cumplimiento por parte del propietario de la solicitud de coti, requisito de la resolución general Nº 2371 de la afip. Bötts Real Estate sasmartín BottgerMatrícula cucicba 8102 / cmcpsi 6853",,,,USD,86,/propiedades/clasificado/veclapin-venta-triplex-2-amb-con-terraza-monte-castro-55314565.html,2,"Monte Castro, Capital Federal",86 m² tot.2 amb.1 dorm.1 baño,,1,WhatsApp,18,,Víctor Hugo  al 1400
98000,,30000,Contactar,"Departamento ubicado en la calle Lavalle al 600 (Edificio Rigards), con Seguridad las 24 hs. Y cochera fija en el mismo edificio. El departamento cuenta con dos plantas de 35 m2 cada una, ambas con placard y aire acondicionado. La primer planta cuenta con piso de parquet plastificado y tiene ventanal con balcón francés. La planta superior tiene piso alfombrado y cuanta con ventana de dos hojas amplias. Da al contrafrente del edificio y es muy silencioso y muy luminoso. Posee baño completo con ducha, pisos de porcelanatto y la totalidad de las cañerías nueva por termofusión. Edificio apto profesional. Último uso como oficina. / nota: Se deja constancia que las medidas, superficies, m2 y proporciones consignadas son aproximadas y pueden variar respecto del titulo de propiedad respectivo, al igual que las medidas parciales y/o de los ambientes están sujetas a verificación y/o ajuste sin comprometer a nuestra empresa. El valor indicado de expensas, si las hubiere, esta sujeto a variación. El precio del inmueble puede ser modificado sin previo aviso. Fotos de carácter no contractual. Todas las operaciones están a cargo de: Martillera Público Nancy Edith Moscovich. Matricula cmcpsi Nro. 1083. Martillera Melisa Yanet Buscaglia. Matricula cucicba Nro. 8702",,1,,USD,70,/propiedades/clasificado/veclapin-departamento-duplex-en-venta-en-san-nicolas-capital-55123780.html,2,"San Nicolás, Capital Federal",70 m² tot.2 amb.1 dorm.1 coch.,$,1,WhatsApp,13,,Lavalle 600
110000,1,120000,Contactar,"Real oportunidad! Venta: Amplio departamento de 3 ambientes de categoría, emplazado en la mejor zona del barrio Monserrat, en el centro de la Ciudad de Buenos Aires: a media cuadra de la Av. Belgrano y dos de la Av. 9 de Julio, el edificio se encuentra a media cuadra del reconocido Hotel Intercontinental. La unidad es muy luminosa, presenta diseño clásico con techos altos y ambientes espaciosos. Cuenta con: -Recibidor que distribuye ingreso a la cocina y al living-comedor. -Gran Living-comedor con salida al patio (de uso exclusivo), el mismo cuenta con lavadero y toilette. -Cómoda cocina separada con salida al patio. -Balcón al frente. -2 amplios dormitorios de generosas dimensiones. -Baño completo con ventilación natural. El edificio se encuentra en excelente estado, posee detalles de diseño y categoría, cuenta con cómodos ascensores, encargado y un pintoresco patio/ jardín de uso común. Corredor Inmobiliario Responsable Kondratenko cucicba Mat 8984 (kondratenko Servicios Inmobiliarios) *Se deja constancia que las medidas y superficies indicados son aproximados y al sólo efecto orientativo. Las medidas reales surgirán del título de propiedad respectivo. Las medidas parciales y/o de los ambientes y el valor consignado de expensas mensuales, servicios y abl está sujeto a verificación y/o ajuste. Art. 4 de la Ley 5. 859 de C. A. B. A: ""Para los casos de alquiler de vivienda única, el monto máximo de comisión que se le puede requerir a los propietarios será el equivalente al cuatro con quince centésimos por ciento (4, 15%) del valor total del respectivo contrato. Se encuentra prohibido cobrar a los inquilinos que sean personas físicas comisiones inmobiliarias cuando el destino sea vivienda única y permanente "". Accesibilidad: El presente inmueble no es accesible para personas con discapacidades físicas.",,,,USD,100,/propiedades/clasificado/veclapin-venta-departamento-3-ambientes-en-monserrat-de-54409714.html,2,"Monserrat, Capital Federal",100 m² tot.2 amb.2 dorm.1 baño,$,2,WhatsApp,25,,Piedras 300
425000,1,,Contactar,"Ubicado en la exclusiva zona de Puerto Madero, este moderno departamento a estrenar se presenta como una oportunidad única para quienes buscan un estilo de vida sofisticado y contemporáneo. Con un precio de U$D 425. 000, este inmueble de 70 m², de los cuales 65 m² son cubiertos y 5 m² descubiertos, ofrece un diseño funcional y elegante. La propiedad se compone de cocina integrada, living comedor, toilette de recepciones, balcón pasante y habitación en suite con vestidor. La cochera cubierta es un gran plus, facilitando el acceso y la comodidad en la vida diaria. Este departamento es apto para uso profesional, lo que lo convierte en una opción versátil para inversores. Con una antigüedad a estrenar, esta propiedad representa la fusión perfecta entre modernidad y funcionalidad en una de las zonas más deseadas de la ciudad, en el dique con mas crecimiento y proyección de Puerto Madero. Amenities: - Seguridad 24hs. - Cocheras de Cortesía. - Piscina abierta con Solárium, con vista al dique. - Piscina en el área del sum, con barra y deck. - Gourmet & amp; wine. - Piscina semi cubierta (in-out pool) - Area de Spa con jacuzzis, duchas, vestidores y Saunas (seco y húmedo) - Salón de meditación y relax. -Gym en ambas torres con espectacular vista hacia el dique. Los metros publicados son aproximados, las medidas exactas surgirán de la escritura traslativa de dominio. La venta de este inmueble está sujeta a la tramitación del Código de Transferencia de Inmuebles (coti), de conformidad con la normativa vigente (Res. Afip 2371/08, 2439/08 y ccs. ) por parte del propietario. Martillero Responsable. Ignacio Rafael Pierucci. mci 9230",,1,,$,70,/propiedades/clasificado/veclapin-venta-departamento-2-ambientes-puerto-madero-55537438.html,2,"Puerto Madero, Capital Federal",70 m² tot.2 amb.1 dorm.1 baño1 coch.,,1,,44,,Juana Manso
Consultar precio,1,,Contactar,"Hermoso departamento 1 dormitorio 121m2 edificio premium en la mejor cuadra de Las Cañitas. Tiene 1 dormitorio en suite, cocina semi integrada, todos los ambientes a gran balcón terraza con parrilla propia. Cochera optativa. Consulta por otras unidades disponibles. Edificio full amenities. Gran piscina. Solarium. sum en el rooftop. Gimnasio. Sauna. Parrillas. Zonas verdes en planta baja. Cocheras fijas. Seguridad. black arce es un edificio premium de triple frente con full amenities con arquitectura de: Estudio Mario Roberto Álvarez y Asoc + Estudio Abramzon en la mejor cuadra de Las Cañitas, a pasos del Boulevard, la Avda. Del Libertador y próximo a rápidos accesos. no dudes en consultar con southland! Tenemos una importante cartera de propiedades premium para ofrecerte a precios muy convenientes en las mejores zonas de Buenos Aires. Mat. Cucicba 5000. La información y medidas provistas son aproximadas y deberán ratificarse con la documentación pertinente. Las fotografías exhibidas no son vinculantes ni contractuales. A menos que se mencione expresamente, la propiedad puede o no contar con accesibilidad para personas con movilidad reducida. En caso de venta, la operación está sujeta a la tramitación del Código de Oferta de Transferencia de Inmuebles (coti) por parte del propietario.",,1,,,121,/propiedades/clasificado/veclapin-hermoso-dpto-1-dor-121-m-sup2--edificio-premium-en-la-54144472.html,2,"Las Cañitas, Palermo",121 m² tot.2 amb.1 dorm.1 baño1 coch.,,1,WhatsApp,7,,Arce 434
92000,1,76000,Contactar,"Corredor Responsable: Ana Gervasoni cpi 7927 / Pablo Emanuel Lopez cmcpm 2995- Contacto: Adriana Cleñán. Descubre este encantador departamento de dos ambientes ubicado en el corazón de Villa Santa Rita. Con una excelente ubicación y un patio techado, este departamento es perfecto para aquellos que buscan un espacio acogedor y funcional. Características: - Dos ambientes amplios y luminosos con ventanas que dan al pulmón del edificio. - Patio techado ideal para disfrutar del aire libre y relajarse. - Excelente ubicación en Villa Santa Rita, cerca de comercios, restaurantes y servicios. - Acceso fácil a transporte público y principales avenidas. Ubicación: - A poca distancia de la Avenida San Martín y la Avenida Rivadavia. - Cerca de la estación de tren de Villa Santa Rita y la estación de subte \""Villa Santa Rita\"" (línea H). - Acceso fácil a la Autopista General Paz y la Autopista Perito Moreno. Oportunidad Única: No te pierdas esta oportunidad de vivir en un departamento acogedor y funcional en Villa Santa Rita. ¡Contacta con nosotros para programar una visita! Remax Argentina S. R. L. No ejerce el corretaje inmobiliario. El presente sitio web es una plataforma en donde cada oficina inmobiliaria independiente que contrata los servicios re/max puede publicar las propiedades a su cargo. Cada oficina es de propiedad y gestión independiente, por lo que Remax Argentina S. R. L no interviene en los datos de la publicación, en la operación inmobiliaria, ni en la confección y/o firma del boleto de compraventa y/o escritura y/o contrato de alquiler. En cumplimiento de las leyes vigentes que regulan el corretaje inmobiliario, Ley Nacional 25. 028, Ley 22. 802 de Lealtad Comercial, Ley 24. 240 de Defensa al Consumidor, las normas del Código Civil y Comercial de la Nación y Constitucionales, los agentes/gestores no ejercen el corretaje inmobiliario. Todas las operaciones inmobiliarias son objeto de intermediación y conclusión por parte del corredor público inmobiliario colegiado a cargo de la publicación, cuyos datos se exhiben en la presente. La presente publicación describe las características esenciales del inmueble, debiéndose consultar al corredor público inmobiliario responsable de la operación por la eventual actualización de las medidas, descripciones arquitectónicas y funcionales, valores de expensas, servicios, impuestos, precios y demás información, cuyos valores son aproximados. El inmueble no es accesible para personas con discapacidades físicas. Comprá la casa que querés! No la que podés. Accedé a un préstamo por hasta el 30% del valor de esta propiedad. Simulá tu cuota en Lendar",,,,USD,65,/propiedades/clasificado/veclapin-2-ambientes-c-patio-interno-excelente-ubicacion-55532869.html,2,"Villa General Mitre, Capital Federal",65 m² tot.2 amb.1 dorm.1 baño,$,1,,18,,General José Gervasio Artigas 1700
114999,1,30000,Contactar,"Cochabamba al 400 entre Bolívar y Defensa, San Telmo. Departamento tipo Loft. Dúplex. Ultra luminoso. Totalmente reciclado a nuevo. Impecable estado. Primer piso por escalera. Contrafrente. Superficie: 80 m2 totales, balcón terraza descubierto. Planta baja del departamento: Living-comedor con cocina incorporada. Baño completo con bañadera, que hace también de Toilette de recepción por su ubicación. Pisos de cerámica. Planta alta: Dormitorio grande en L, con ventana exterior, pisos de madera, y vestidor. Calefacción por tiro balanceado a gas. Bajas Expensas $30. 000 (incluye abl, Aysa). Tiene gas natural. Edificio totalmente reciclado. Venta U$S 114, 999. Consultas y visitas Ver datos (WhatsApp). A 1 cuadra de Av. Juan de Garay. A 2 cuadras de Plaza Dorrego (zona de anticuarios, bares, restaurantes, etc. ) A 2 cuadras de Parque Lezama. A 2 cuadras de Av. Brasil. A 4 cuadras de Puerto Madero. Maximiliano Sucksdorf Servicios Inmobiliarios - Cucicba 8128",,,,USD,80,/propiedades/clasificado/veclapin-cochabamba-400-2-ambientes-grande-loft-duplex-ultra-51908255.html,2,"San Telmo, Capital Federal",80 m² tot.2 amb.1 dorm.1 baño,$,1,WhatsApp,29,,Cochabamba 400
73000,1,,Contactar,3 ambientes tipo casa - Contrafrente - Hall de entrada y hall de distribución - Living comedor con pisos de parquet - Cocina comedor - Dos dormitorios con placards - Baño completo.,,,,USD,86,/propiedades/clasificado/veclapin-olavarria-al-600-54045422.html,2,"La Boca, Capital Federal",86 m² tot.2 amb.2 dorm.1 baño,,2,WhatsApp,5,,Olavarría 600
120000,1,190000,Contactar,Excelente ubicación sobre la calle Paraná esquina Av. Santa Fé. Apto profesional. El departamento se encuentra en el 8°piso. Superficie total 60m2. Consta de 2 monoambientes unificados para refaccionar.,,,,USD,60,/propiedades/clasificado/veclapin-departamento-en-venta-apto-profesional-barrio-norte-54507807.html,2,"Barrio Norte, Capital Federal",60 m² tot.2 amb.1 baño,$,,WhatsApp,11,,Dirección no informada
109999,1,30000,Contactar,"Cochabamba al 400 entre Bolívar y Defensa, San Telmo. Impecable. Listo para mudarse. Ultra luminoso. Departamento tipo Loft. Primer piso por escalera. Al frente a la calle. Con balcón. Superficie: 68 m2 totales y cubiertos. Dúplex. Planta baja: Living-comedor con salida al balcón al frente a la calle (en total el living tiene 3 ventanas al frente), y con la cocina incorporada. Baño completo con bañadera, que hace también de Toilette de recepción por su ubicación. Pisos de cerámica. Planta alta: Dormitorio con 3 ventanales al exterior y pisos de madera. Muy luminoso. Expensas $30. 000. Tiene gas natural. Edificio reciclado hace 12 años. Venta U$S 109. 999. Consultas y visitas Ver datos (WhatsApp). A 1 cuadra de Av. San Juan. A 1 cuadra de Av. Juan de Garay. A 2 cuadras de Plaza Dorrego. A 2 cuadras de Av. Brasil. A 3 cuadras de Parque Lezama. A 5 cuadras de Av. 9 de Julio. Maximiliano Sucksdorf Servicios Inmobiliarios - Cucicba 8128",,,,USD,68,/propiedades/clasificado/veclapin-cochabamba-400-primer-piso-x-escalera-loft-68-m-sup2-54440585.html,2,"San Telmo, Capital Federal",68 m² tot.2 amb.1 dorm.1 baño,$,1,WhatsApp,28,,Cochabamba 400
82000,1,,Contactar,"En venta en capital federal en uno de los lugares mas historicos de la ciudad de buenos aires; hermoso departamento de 2 ambientes con baño instalado; hall de entrada living comedor; hoy no posee cocina si bien esta toda la instalacion para la misma ya que se utiliza como oficina lo mismo que la pared divisoria de la habitacion. Amplio balcon doble al frente. Venta inmediata. consulte dirección Y detalles al Ver datos o whatsapp Ver datos por el código 9989. Deje su propiedad en buenas manos. Desde 1978 brindando seguridad y confianza en sus operaciones inmobiliarias. Tasaciones Inmediatas. 011 Ver datos y líneas rotativas. whatsapp Ver datos. Av. Wernicke 2895. Ciudad Jardín - Lomas de El Palomar, Tres de Febrero, Buenos Aires.",,,,USD,73,/propiedades/clasificado/veclapin-en-venta-en-monserrat-departamento-de-2-ambientes-al-53990336.html,2,"Monserrat, Capital Federal",73 m² tot.2 amb.1 dorm.1 baño,,1,WhatsApp,46,,ADOLFO ALSINA
