price_value,bathrooms,expenses_value,CARD_CONTACT_MODAL,description,phone,parking,CARD_VIEWPHONE,price_type,square_meters_area,url,rooms,location,POSTING_CARD_FEATURES,expenses_type,bedrooms,CARD_WHATSAPP,POSTING_CARD_GALLERY,CARD_FAV,address
USD 1,1,,Contactar,"Living comedor con salida a balcón, toilette de recepción, cocina. Dormitorio en suite con vestidor. El departamento incluye una cochera. Amenities de categoría, vigilancia 24hs. entrega inmediata",,1,,,75,/propiedades/clasificado/veclapin-departamento-de-dos-ambientes-en-pasaje-del-golf-54429747.html,2,"Belgrano, Capital Federal",75 m² tot.2 amb.1 dorm.1 baño1 coch.,,1,WhatsApp,15,,Virrey del Pino al 1400
85000,1,1500,Contactar,"Apto credito. Hermoso gran 2 Ambientes originalmente 3 ambientes (uno de los dormitorios se anexo al living) A 4 cuadras del subte y con varias lineas de colectivos en la puerta. El departamento es muy luminoso. Cocina comedor amplia y con un ventanal que da al pulmón del edificio. Living comedor con piso flotante y muy amplio. Baño completo con bañera. Dormitorio con piso de madera y placard. Para más información, llámanos al: Ver datos. Aviso publicado por R Buschiazzo Propiedades",,,,USD,74,/propiedades/clasificado/veclapin-venta-amplio-2-ambientes-en-once-oportunidad!-42931157.html,2,"Once, Capital Federal",74 m² tot.2 amb.1 dorm.1 baño,$,1,WhatsApp,5,,Larrea al
435000,1,425000,Contactar,2 Ambientes. 1 Dormitorio en suite. Amplio vestidor. Cocina integrada. Living comedor. Toilette. Balcón integral. Amoblado. 68 m2. Seguridad 24 hs. Amenities Piscinas Spa Saunas Hidromasajes Jacuzzi Sum. Cochera cubierta,,1,,$,67,/propiedades/clasificado/veclapin-venta-en-torres-link-alquiler-2-ambientes-piso-27-55642473.html,2,"Puerto Madero, Capital Federal",67 m² tot.2 amb.1 dorm.1 baño1 coch.,$,1,WhatsApp,11,,1965 Juana Manso
109000,1,140000,Contactar,"Hermoso departamento de 2 1/2 ambientes, en edificio de categoria, con excelentes pisos de pinotea, aberturas de roble, y altos techos. Cuenta con 2 habitaciones (Una con vestidor y acceso al baño), amplia cocina con comedor diario y lavadero independiente, un amplio living comedor con salida a los balcones. Posee tambien un 3er espacio que puede utilizarse como Oficina / Biblioteca o 3er habitacion (Pequeña). Es 1 departamento por piso. El Edificio dispone de una terraza de uso común en el 9no piso. Edificio con ascensor. Apto Credito",,,,USD,64,/propiedades/clasificado/veclapin-espectacular-departamento-de-estilo-2-1-2-ambientes!-54973506.html,2,"Monserrat, Capital Federal",64 m² tot.2 amb.1 dorm.1 baño,$,1,WhatsApp,42,,Rivadavia  al 900
115000,1,130000,Contactar,Hermoso departamento de 3 ambientes convertido en 2 (se puede volver a separar). Totalmente reciclado. Amplio living comedor. Cocina completa con lavadero independiente. 3 equipos split aire acondicionado frio-calor (2 inverter). Patio. Baño completo y toilette. Comedor diario o escritorio. Media cuadra Subte E. Excelente estado. Cucicba Matr. 298,,,,USD,72,/propiedades/clasificado/veclapin-hermoso-3-ambientes-convertido-en-2-grandes.-impecable-54935238.html,2,"Parque Chacabuco, Capital Federal",72 m² tot.2 amb.1 dorm.1 baño,$,1,WhatsApp,18,,josé maria moreno 864 PB A
70000,1,200000,Contactar,"Departamento 2 ambientes con local venta en San Nicolás. 42m2 del departamento - expensas 200. 000ars. Se ingresa por el living-comedor con cocina incorporada, con alacena, lavaplatos con agua caliente y fría y bajo mesada. Esta habitación posee equipo de aire acondicionado tipo Split (converter) frio-calor y también calefacción por placa eléctrica en la pared. Por escalera caracol se desciende al dormitorio principal. El dormitorio cuenta con equipo acondicionador de aire tipo Split frío-calor. Una puerta corrediza conduce a un baño completo (con lavatorio, inodoro, ducha con bañadera y bidet (matic). Otra puerta corrediza conduce a la habitación secundaria (dormitorio y escritorio) que cuenta con piso flotante y equipo de aire acondicionado frio. Se calefacciona con dos placas eléctricas en la pared. Local: 20m2 -apto professional. -La propiedad se vende en forma conjunta con un local comercial de 20 m2 (aproximadamente), ubicado en la Galería Paseo Corrientes Angosta. El local tiene expensas de aproximadamente $40. 000 mensuales. --No es apto crédito. Nota: La información gráfica y escrita contenida en el presente aviso es meramente a titulo estimativo y no forma parte de ningún tipo de documentación contractual. Las medidas y superficies definitivas surgirán del título de propiedad del inmueble referido. Asimismo los importes de tasas, servicios y expensas indicados están sujetos a verificación. El valor del inmueble indicado en el presente puede ser modificado sin previo aviso.",,,,USD,62,/propiedades/clasificado/veclapin-departamento-2-ambientes-con-local-venta-en-san-55492263.html,2,"San Nicolás, Capital Federal",62 m² tot.2 amb.1 dorm.1 baño,$,1,WhatsApp,38,,LAVALLE 700. Entre Esmeralda y Maipu
110000,2,,Contactar,"Departamento de 2 ambientes al frente en duplex, baño en suite con vestidor y toilette en pb. Importante unidad a la vista tipo Pent House, ultimo piso al frente con balcón aterrazado con vista abierta. Posibilidad de acceder mediante financiamiento. En la primera planta esta el living comedor con pisos flotantes, cocina incorporada con muebles bajo mesada y alacena con terminaciones en acero inoxidable, espacio para el lavarropas bajo mesada. Toilette y balcón aterrazado. En planta superior, dormitorio con preinstalación para aire acondicionado, ventanas de aluminio anodizado con ajustes afelpados, vestidor con interiores, estantes barral y cajoneras. Baño completo en suite. Aire acondicionado instalado frio calor. Se entrega pintado en su interior con pintura Látex de primera calidad. A estrenar. Edificio terminado en Noviembre 2021. Cifre profesionales inmobiliariossucursal Villa Pueyrredon - Ver datosSucursal Villa Urquiza - Ver datosSucursal Villa Devoto - Ver datosnueva Sucursal Belgrano - Ver datos",,,,USD,999,/propiedades/clasificado/veclapin-departamento-de-2-ambientes-al-frente-en-duplex-con-48851845.html,2,"La Paternal, Capital Federal",999 m² tot.2 amb.1 dorm.2 baños,,1,WhatsApp,15,,Terrero al 1900
106900,1,,Contactar,"Contacto 1Ver datos. living con salida A terraza de 26 metros. Vista abierta A la ciudad. cocina con barra, muebles, Y mesada de granito. Cuenta con anafes eléctricos de primera marca. baño completo con bañadera, mesada de mármol Y griferías Y artefectos sanitarios de primera marca. Agua caliente central. dormitorio amplio con placard (sin interiores) todas las carpinterias son de aluminio Y doble vidrio. construcción en ladrillo, no durlock. se entrega con: - Aire acondicionado frio/calor. - Pisos vinílicos. - Cerraduras digitales. el edificio: - sum. - Solarium con ducha. - Parrilla. - Laundry. - Grupo electrógeno. - Hall de acceso de moderno diseño. Fecha Finalización de Obra: Octubre de 2025. En caso de abonar un anticipo del 70% se podrá cancelar el saldo en cuotas en dólares. Ubicado en pleno corazón de San Telmo, el edificio se encuentra frente al Metrobus, a pasos de la Estación de Subte San Juan y cercano a universidades como la uade, uca, uai y La Facultad de Ciencias Sociales (uba). Con una conectividad inmejorable. El departamento es apto profesional y alquiler temporario, por lo que es maravilloso tanto para vivienda propia como para el inversor. Las fotos son a titulo orientativo. las medidas son solo informativas. Las definitivas surgiran del respectivo plano Y titulo de propiedad.",,,,USD,60,/propiedades/clasificado/veclapin-oportunidad-2-ambientes-con-amplia-terraza-en-pozo-54591383.html,2,"San Telmo, Capital Federal",60 m² tot.2 amb.1 dorm.1 baño,,1,WhatsApp,10,,Bernardo de Irigoyen 1100
173000,,,Contactar,"Te presentamos un edificio moderno de departamentos con terrazas con piscina y patios privados con parrilla, donde La Luz, y el aire libre son protagonistas. Disfruta de espacios amplios y luminosos, diseñados para tu bienestar y comodidad. Los departamentos cuentan con losa radiante por piso, conexión para equipos de aire acondicionado, mesadas de marmol e interiores de placard en habitaciones y cocina instalados. Puerta de seguridad macizas con cerraduras electrónicas con cámara y manejo wifi. Cocheras cubiertas disponibles.",,,,$,159,/propiedades/emprendimiento/ememvein-departamentos-en-villa-urquiza.-terrazas-privadas.-55469854.html,3,"Villa Urquiza, Capital Federal",3 un.2 a 3 amb.66 a 159 m² tot.,,,,4,,Av Combatientes de Malvinas 3852
92000,1,160000,Contactar,"Departamento de dos ambientes en primer piso en San Nicolás. Cuenta con living comedor amplio, con aire acondicionado frío/calor, cocina con ventana y espacio para lavarropas; la cocina es a gas, completa con muebles bajo mesada y alacenas. La habitación tiene un gran ventanal con vista a la parte interna del edificio. Baño completo con ducha, en buen estado. El edificio tiene once pisos, cuatro unidades por piso, encargado fijo. El departamento es apto profesional y no tiene cochera. Ubicado cerca de la zona de los Tribunales, el Teatro Colón, el Registro Civil; zona de bares, cafés, restaurantes, bancos, oficinas. Está cerca de las avenidas Córdoba y Corrientes, por donde circulan gran cantidad de líneas de colectivos y las líneas de subte B (estación Uruguay sobre Avenida Corrientes) y D (estación Tribunales - Teatro Colón), y de la Avenida 9 de Julio, por donde circula el Metrobús.",,,,USD,65,/propiedades/clasificado/veclapin-departamento-en-san-nicolas-54912050.html,2,"San Nicolás, Capital Federal",65 m² tot.2 amb.1 dorm.1 baño,$,1,,12,,Uruguay  al 700
95000,1,260000,Contactar,"Oportunidad! Amplio departamento de 2 ambientes en planta baja, con patio! Ubicado sobre la calle Eduador, entre Arenales y Beruti, en pleno barrio de la Recoleta. A dos cuadras de Av. Santa Fe. Todos los colectivos. Subte D, estación Pueyrredon. Zona Hospital Alemán. Facultad uba de Ingeniería. Edificio de Categoría. 6 pisos, Semipisos. El departamento esta en pb, a la calle. Living comedor muy amplio con pisos de parquet, ventanal hacia la calle, Hall de Distribución con gran placard de apoyo. Cocina separada, con salida al patio (hoy cubierto con un cerramiento de vidrio). Baño completo con bañera. Dormitorio con piso de parquet con placard, ventana al patio. La calefacción es por radiadores. Excelente oportunidad! Para visitarlo escribime por whatsapp al +54 9 11 Ver datos. Martillero y Corredor Público Luis Alderete. Matricula 7587 cucicba.",,,,USD,68,/propiedades/clasificado/veclapin-2-ambientes-pb-con-patio-en-recoleta-55552297.html,2,"Recoleta, Capital Federal",68 m² tot.2 amb.1 dorm.1 baño,$,1,WhatsApp,28,,Ecuador al 1500
129000,1,,Contactar,"Apto Credito. Características Principales: - Ubicación: Excelente, con cercanía al polo gastronómico de Monte Castro. El inmueble esta situado al frente del edificio, y cuenta con un balcón aterrazado al frente y otro balcón semicubierto al contrafrente, brindando una agradable vista y ventilación cruzada. En la cuadra se encuentra el reconocido edificio de Michelin con seguridad 24hs. Ambientes: - Ingreso al edificio con llave magnetica para mayor rapidez y seguridad. - Living: Amplio y luminoso, ideal para crear un espacio de relax y entretenimiento con un balcón al contrafrente semicubierto. - Cocina: Espaciosa y cómoda, equipada con muebles de calidad y un comedor integrado, perfecta para quienes disfrutan de cocinar y compartir momentos en familia o con amigos. - Se puede planificar un entrepiso, o agregar una división y convertirlo en 3 ambientes. - Baño de recepción: Práctico y funcional para visitas. - Baño completo en el dormitorio superior: Equipado con mampara y terminaciones modernas. - Piso completo de porcelanato. - Termotanque de alta recuperación de agua. - Gas natural, agua corriente y termotanque, garantizando comodidad y eficiencia. - El exterior del edificio y departamento se encuentra pintado en su totalidad para entregarlo como nuevo. - Dormitorio: Ubicado en la planta superior, cuenta con un vestidor y acceso a un baño completo. Desde el dormitorio, se disfruta de una increíble vista a la cocina y al balcón aterrazado, aportando un toque único y sofisticado al espacio. - Aire frío-calor que ambienta todos los espacios, asegurando confort durante todo el año. - Piso Flotante en el dormitorio, aportando calidez y estilo. Amenities ( sin costo alguno sum - laundry - terraza con parrilla) - Laundry: Espacio destinado para el lavado de ropa, facilitando las tareas del hogar. - sum (Salón de Usos Múltiples): Ideal para reuniones, eventos y actividades sociales. - Parrilla al aire libre en la terraza: Perfecta para disfrutar de asados y momentos al aire libre con amigos y familiares. Este excelente departamento estilo loft destaca por su increíble vista y luminosidad, a la venta a un precio inigualable. Diseñado para aquellos que buscan confort y modernidad en un mismo lugar, el departamento se encuentra en una ubicación privilegiada, cercana a la vibrante escena gastronómica de Monte Castro. Su diseño y distribución optimizados ofrecen un espacio de vida práctico y elegante, ideal para disfrutar del día a día en un entorno agradable y moderno. Zona comercial céntrica de Monte Castro, con muchas conexiones alrededor ( mas de 8 líneas de colectivos), a dos cuadras de av. Lope de Vega y av. Álvarez Jonte, . A 10 cuadras del Shopping de Devoto. Estado de propiedad: Muy bueno. Entrega la propiedad con la documentación en condiciones para la compraventa. Para visitar. Cherquetti propiedades bermudez 1865 tel. 4 5 6 7 4 3 8 7 Y rot. Whatsapp 1 1 3 1 0 7 9 1 7 9. De lunes A viernes de 11 A 18hs",,,,$,65,/propiedades/clasificado/veclapin-excelente-semipiso-de-2-ambientes-al-frente-tipo-loft-54075675.html,2,"Monte Castro, Capital Federal",65 m² tot.2 amb.1 dorm.1 baño,,1,WhatsApp,27,,Lascano 5100
105000,1,120000,Contactar,A estrenar ya! Tercer piso al frente con terraza propia de 45m2. Super luminoso con vista a plaza. Horno y Anafe electrico. Agua caliente central. Edificio con sector de parrilla. Entrega inmediata.,,,,USD,80,/propiedades/clasificado/veclapin-a-estrenar-ya!-2-ambientes-terraza-ppia!-vista-a-plaza-54839890.html,2,"Floresta, Capital Federal",80 m² tot.2 amb.1 dorm.1 baño,$,1,WhatsApp,23,,Bogota 3799 3ro. A
1111,1,,Contactar,"Edificio finalizado el 12 de Febrero del 2025, completamente a estrenar. Edificio con orientación Norte. La unidad que se muestra es la modelo - 1ro B. Todas las unidades cuentan con: - Espacio para lavarropas / lavavajillas. - Vidrios dvh con carpintería aluar A40. - Dos Aires acondicionados lg ya instalados en Living y Dormitorio (equipo de refrigeración es Multisplit) - Se entrega con horno (nv7000B) y Anafe Samsung (ctr264) - Portero eléctrico. - Interiores de Placard. El edificio cuenta: - Con un local comercial gastronómico en planta baja. Teniendo ventilación cuatro vientos preinstalada para su utilización. El edificio no cuenta: - Con cocheras. Unidades Disponibles a la venta en el desarrollo: Primer Piso A. Primer Piso B. Segundo Piso A. Segundo Piso B. Tercer Piso A. Tercer Piso C. Cuarto Piso A. Cuarto Piso C. Quinto Piso B. Quinto Piso C. Sexto Piso B. Séptimo Piso B. por favor comunicarse por whatsapp O por mail.",,,,$,62,/propiedades/clasificado/veclappa-departamento-2-ambientes-caballito-sur-48637014.html,2,"Caballito, Capital Federal",62 m² tot.2 amb.1 dorm.1 baño,,1,WhatsApp,5,,José A. Terry 301 esquina Valle 1268
120000,1,,Contactar,"Departamento 2 ambientes 3 ""D"" contra frente. La unidad cuenta con balcon. Terraza propia 23 mts2. Cochera cubierta fija. Las superficies cubiertas son aproximadamente de 42 mts2 por unidad y a esta superficie se suman los metros semi y descubiertos. Los detalles de construccion y las terminaciones utilizadas son de primera linea. Aire Frio calor colocado e instalado en todos los ambientes de la propiedad. Sanitarios de linea Fv. Porcelanatos y marmol a medida tanto en las cocinas como en los baños. apto A financiacion",,1,,USD,68,/propiedades/clasificado/veclapin-dpto-2-ambientes-a-estrenar-con-terraza-y-cochera-54028099.html,2,"Mataderos, Capital Federal",68 m² tot.2 amb.1 dorm.1 baño1 coch.,,1,WhatsApp,19,,Zelada 6449
110000,1,230000,Contactar,"Gran edificio emblamatico en zona del congreso, estilo frances, remodelado. Se trata de un departamento en venta de dos ambientes grande con techos altos Y mucho lujo. Tiene un living-comedor, cocina, habitacion en suit con un placard empotrado de piso A techo. Tiene un patio hermoso para disfrutar de las mañanas O las tardes soleadas, con posibilidad A cochera. - el edificio tiene vigilncia las 24 hs, ascensor Y terraza. Cuenta con cochera privada que se paga aparte. Es una excelente zona, ya que se encuentra en el corazon del centro de la ciudad de buenos aires, con muchisimos puntos emblematicos como lo son el congreso nacional, el cabildo, la casa rosada, museos, teatros como el colon Y muchos mas, cines, lugares para comer O tomar algo Y cercania A todas las lineas de subtes, tren sarmiento, gran cantidad de lineas de colectivo, avenidas muy concuridas como av rivadavia, av corrientes, av belgrano, av cordoba, entre otras. Posee todos los servicios de agua, luz Y gas. Todo al dia. expensas de $230. 000. no te lo pierdas Y reserva ya tu visita!! No Accesible para personas con movilidad reducida – Ley 5115, Art. 1 y 2 caba. Toda la información y medidas provistas son aproximadas y deberán ratificarse con la documentación pertinente. Los impuestos y gastos expresados se refieren a la última información recabada y deberán confirmarse. Las fotografías no son vinculantes ni contractuales. Esta operación inmobiliaria se encuentra a cargo y es objeto de intermediación y conclusión por parte del Corredor Inmobiliario matriculado porta, carla sofia cucicba 9119.",,1,,USD,74,/propiedades/clasificado/veclapin-venta-departamento-2-ambientes-54138729.html,2,"Congreso, Capital Federal",74 m² tot.2 amb.1 dorm.1 baño1 coch.,$,1,WhatsApp,19,,PARANA
107000,1,,Contactar,"Departamento de 2 ambientes con exclusivo patio de 83 m2. A estrenar. Living comedor amplio y dormitorio (ambos con salida al patio). Baño completo y cocina. Ubicado en Catamarca 1068. A dos cuadras de Av. San Juan y Av. Jujuy, medios de transporte y 2 lineas de subte. Edificio con sum, laundry y solarium. Apto profesional. Cocheras disponibles. Superficie aprox: ■ 42, 5 m2 cubiertos. ■ 83 m2 de patio/terraza. Entrega prevista: Diciembre 2024. Posee un avance de obra del 90% Agua caliente central. Ultimas unidades disponibles. ¡Coordinar visita! Vende. sd propiedades. mat 7828",,,,USD,125,/propiedades/clasificado/veclapin-2-ambientes-con-exclusivo-patio-para-inversion-o-55630558.html,2,"San Cristobal, Capital Federal",125 m² tot.2 amb.1 dorm.1 baño,,1,WhatsApp,10,,Catamarca 1068
84000,1,65000,Contactar,"¡ 2 ambientes al frente! ¡ con patio único, todo luz! #Departamento | #Estándar | #2amb | #Patio | #Frente | #BoedoVirrey Liniers 800, Piso 2- Ciudad Autónoma de Buenos Aires· Características: ~ Departamento de dos (2) ambientes, dispuesto hacia el frente, con patio propio hacia el interior, en excelente ubicación del barrio de Boedo. ~ Orientación hacia el E (Este) con la calidez propia del sol de la mañana. Ventilación cruzada. Todos sus ambientes cuentan con ventanas/ventanales que iluminan hacia el exterior. ~ Disfruta de su amplio patio privado, perfecto para reuniones inolvidables con amigos y familiares, y momentos de ocio y confort en tu propio espacio. ~ Su disposición dentro del plano del edificio lo hace ideal puesto que no comparte vistas con unidades vecinas, brindando confidencialidad, tranquilidad y bienestar. ~ Segundo piso por escaleras. La unidad ha sido reciclada íntegramente e incorporando mínimos detalles, se encontraría lista para ser habitada. ~ A 37 metros de Avenida Independencia. A 237 metros de Avenida Boedo. A 363 metros de Avenida San Juan. A 737 metros de Avenida Jujuy. ~ Conectividad con medios de transporte. Múltiples colectivos y subte/metro Línea E · Estación Boedo. Cercanía a subida/bajada a Autopista (au) 25 de Mayo. ~ Su oferta comercial incluye actividades recreativas y culturales, locales gastronómicos, farmacias, paseos, instituciones médicas y educativas. · Edificio: ~ Entre medianeras, construido en el año 2004. Su fachada combina ladrillo visto con hormigón pintado en color blanco y cerámicas marmoladas color verde imperial. ~ Su planta baja se encuentra revestida en ladrillo visto. Su hall de ingreso posee pisos de porcelanato y paredes pintadas de blanco. Sus palieres semi-privados garantizan un habitar pacífico. ~ 3 pisos. 3 departamentos por cada piso. No cuenta con ascensor. Expensas comunes en valores estándar. Previsibles gastos de mantenimiento mensuales. · Distribución: ~ Hall de recepción (2. 00m x 1. 00m) . ~ Living comedor (5. 00m x 3. 00m) . ~ Patio interior (4. 20m x 3. 20m) . ~ Cocina (3. 50m x 2. 20m) . ~ Distribuidor (1. 05m x 2. 20m) . ~ Baño completo con bañera (2. 00m x 1. 60m) . ~ Dormitorio (3. 50m x 2. 85m) . · Equipamiento: ~ Paredes pintadas en tonalidades claras conservan su natural luminosidad. Pisos revestidos en cerámicas símil madera en hall de recepción, living comedor y dormitorio. ~ Su cocina posee pisos revestidos en cerámicas anaranjadas y paredes revestidas en cerámicas blancas. Cuenta con termotanque a gas instalado en su patio interior. ~ Mobiliario de cocina (alacena/bajo mesada) de melamina / mdf color blanco. Bacha doble de acero inoxidable. Mesada de cocina de granito modelo rosa de salto. ~ Baño con pisos revestidos en cerámicas color terracota imperial y paredes combinadas con guarda y cerámicas gris. Cuenta con vanitory, artefactos completos y bañera. ~ Cuenta con placares empotrados con divisores, estantes, barrales, cajoneras y demás interiores a medida en distribuidor. Aire acondicionado split F/C en su dormitorio único. ~ Calefacción individual a través de estufas. Conexión para carga y descarga de lavarropas. Espacio de tendido en patio. Aberturas línea módena de aluminio color blanco instaladas. · Superficies: ~ 48. 18M2: Superficie cubierta~ 12. 28M2: Superficie descubierta~ 60. 46M2: Superficie total#Nota: El edificio no cuenta con accesibilidad para personas con movilidad reducida (Ley 5115) . Las imágenes en este anuncio publicadas son meramente ilustrativas y no poseen carácter contractual. El importe de expensas anunciado ha sido extraído de su última facturación, es orientativo, no vinculante y está sujeto a modificaciones y/o variaciones sin previa publicidad. Las medidas expresadas en el presente aviso son aproximadas y a título informativo. Las medidas originales surgirán de los respectivos planos y/o escritura del inmueble. Somos especialistas en operaciones simultáneas. Tasamos en los 48 barrios de la Ciudad de Buenos Aires: . ar/tasaciones/spinelli propiedadeswww. spinelliprop. com. ar#Visitas por WhatsApp al +54 9 11 Ver datos#Reservas al Ver datos Ver datos#Consultas a Ver datos#Oficina en Avenida San Juan 3467 - cabadesde 1921 - #OportunidadesGrandesComoUnaCasa",,,,USD,60,/propiedades/clasificado/veclapin-venta-2-ambientes-60-m-sup2--patio-unico-frente-54420270.html,2,"San Cristobal, Capital Federal",60 m² tot.2 amb.1 dorm.1 baño,$,1,WhatsApp,38,,Virrey Liniers al 800
115000,1,80000,Contactar,"Departamento de 2 ambientes en pb al frente, muy amplio. Excelente ubicación, a 2 cuadras del subte linea D y a metros de Av. Rivadavia y Av. J. B. Alberdi. Living y dormitorio muy amplios, hall de distribucion ( posible escritorio), 2 balcones, baño completo y cocina con espacio para desayunador.",,,,USD,84,/propiedades/clasificado/veclapin-ramon-falcon-1400-2-ambientes-muy-amplio-con-54377229.html,2,"Caballito, Capital Federal",84 m² tot.2 amb.1 dorm.1 baño,$,1,WhatsApp,23,,Ramon Falcon 1300
118000,1,180000,Contactar,"Excelente depto de 2 ambientes con cochera fija, portón automático, al contrafrente con un gran balcón aterrazado tipo terraza, muy luminoso, edificio nuevo, detalles de categoría, 2 equipos split frío calor, cocina, placard Y bajo mesada. Apto profesional. Gran cantidad de medios de locomoción A 1 cuadra del subte. Zona facultades uade, uai. Las descripciones arquitectónicas y funcionales, valores de expensas, impuestos y servicios y medidas de este inmueble son aproximados. Los datos fueron proporcionados por el propietario y pueden no estar actualizados a la hora de la visualización de este aviso por lo cual pueden arrojar inexactitudes y discordancias con las que surgen de los las facturas, títulos del inmueble.",,1,,USD,60,/propiedades/clasificado/veclapin-humberto-i-al-800-depto-de-2-amb-con-cohera-cubierta-48943144.html,2,"San Telmo, Capital Federal",60 m² tot.2 amb.1 dorm.1 baño1 coch.,$,1,WhatsApp,15,,HUMBERTO 1°  800
